Constituency,DistrictEnglish,DistrictNepali,CandidateEnglish,CandidateNepali,Source,Title,URL,Snippet,Content,RelevanceScore,ScrapedAt
1,rukum_east,रुकुम (पूर्वी भाग),Kusum Devi Thapa,कुसुम देवी थापा,DDG (ne1),कुसुम देवी थापा :: Nepal Election 2082 | Thaha Khabar Candidate ...,https://election.thahakhabar.com/candidate-detail/2829,प्रदेश (Province) लुम्बिनी जिल्ला (District)रुकुम(पूर्वीभाग)निर्वाचनक्षेत्र (Constituency)रुकुम(पूर्वीभाग)- १ उम्मेदवारहरु,प्रदेश (Province) लुम्बिनी जिल्ला (District)रुकुम(पूर्वीभाग)निर्वाचनक्षेत्र (Constituency)रुकुम(पूर्वीभाग)- १ उम्मेदवारहरु,24.0,2026-03-05T14:51:45.621868
1,rukum_east,रुकुम (पूर्वी भाग),Kusum Devi Thapa,कुसुम देवी थापा,DDG (en1),Kusum Devi Thapa - Nepali Congress Candidate for Rukum (East ...,https://youthsforum.com/election/nepali-congress/kusum-devi-thapa/,"KusumDeviThapa: Biography, Education, and Political JourneyKusumDeviThapais a parliamentarycandidaterepresenting Nepali Congress in theNepalParliamentElection2082. She is contesting fromRukum(East)Constituency-1 in Lumbini Province, bringing her vision and experience to serve the people of this region.","KusumDeviThapa: Biography, Education, and Political JourneyKusumDeviThapais a parliamentarycandidaterepresenting Nepali Congress in theNepalParliamentElection2082. She is contesting fromRukum(East)Constituency-1 in Lumbini Province, bringing her vision and experience to serve the people of this region.",23.0,2026-03-05T14:51:45.621883
1,rukum_east,रुकुम (पूर्वी भाग),Kusum Devi Thapa,कुसुम देवी थापा,DDG (en1),Kusum Devi Thapa - Wikipedia,https://en.wikipedia.org/wiki/Kusum_Devi_Thapa,"KusumDeviThapais a Nepalese politician, belonging to the Nepali Congress Party. She is currently serving as a member of the 2nd Federal Parliament ofNepal. In the 2022 Nepalese generalelectionshe was elected as a proportional representative from the indigenous people category. [1][2] She is the Chairperson of the Agriculture, Cooperatives and Natural Resources Committee of the House of ...","KusumDeviThapais a Nepalese politician, belonging to the Nepali Congress Party. She is currently serving as a member of the 2nd Federal Parliament ofNepal. In the 2022 Nepalese generalelectionshe was elected as a proportional representative from the indigenous people category. [1][2] She is the Chairperson of the Agriculture, Cooperatives and Natural Resources Committee of the House of ...",22.0,2026-03-05T14:51:45.621885
1,rukum_east,रुकुम (पूर्वी भाग),Kusum Devi Thapa,कुसुम देवी थापा,DDG (ne1),"कुसुम देवी थापा, रूकुम पूर्व - १ | नेपाली कांग्रेस | प्रतिनिधि सभा ...",https://election.ratopati.com/candidate/kusum-devi-thapa,प्रतिनिधि सभानिर्वाचन२०८२ अन्तर्गत रूकुम पूर्व - १ मा नेपाली कांग्रेसकाउम्मेदवारकुसुमदेवीथापाकोनिर्वाचनप्रोफाइल।,प्रतिनिधि सभानिर्वाचन२०८२ अन्तर्गत रूकुम पूर्व - १ मा नेपाली कांग्रेसकाउम्मेदवारकुसुमदेवीथापाकोनिर्वाचनप्रोफाइल।,19.0,2026-03-05T14:51:45.621887
1,rukum_east,रुकुम (पूर्वी भाग),Kusum Devi Thapa,कुसुम देवी थापा,OnlineKhabar EN,Polling officer resigns in Rukum East amid dispute over staff deployment,https://english.onlinekhabar.com/polling-officer-resigns-in-rukum-east-amid-dispute-over-staff-deployment.html,,"Polling officer resigns in Rukum East amid dispute over staff deployment Balaram Sherpali Tuesday, February 24, 2026 0 Comments Rukum East, February 24 A dispute has intensified in Rukum East over the deployment of personnel for the House of Representatives election scheduled for Falgun 21, after a designated polling officer refused to assume his responsibilities. Ram Prasad Khadka, Assistant Education Officer of Putha Uttarganga Rural Municipality, declined to serve as a polling officer, alleging that teachers were sidelined in favour of health workers for election duties. Submitting a written letter to the District Election Office, Rukum East, Khadka announced his resignation from the post of polling officer assigned to Nepal Rastriya Secondary School, Chunwang, Ward No. 9 of Bhume Rural Municipality. In his letter, Khadka accused the Election Commission of adopting a discriminatory policy that undermines teachers’ professional dignity. “Teachers who enlighten society with education have been completely bypassed. When the state fails to respect their dignity and responsibility, my conscience does not allow me to serve as a polling officer,” he wrote. Widespread objection over the deployment of health workers The controversy began after the District Election Office decided to mobilise a large number of health workers for election duties. Earlier, both the Nepal Teachers’ Federation and the Rukum East chapter of the Federation of Nepali Journalists had urged authorities not to deploy health workers in election-related tasks and instead keep them focused on regular health services. The Ministry of Health and Population had also written to the Election Commission, stating that health workers should remain on 24-hour alert during the election period and should not be assigned election duties. Despite this, health workers were appointed to election roles in the district, even though employees from other sectors were available, further fueling dissatisfaction. Election office under pressure With the election approaching, the refusal of a designated official to take up his role has placed the District Election Office under pressure. Conflicting directives from the Health Ministry and dissatisfaction among teachers have created challenges in election management in the district. Following Khadka’s decision, other teachers and education-sector employees have also begun voicing their objections. How the District Election Office addresses the situation and fills the vacant position has become a matter of public concern across the district. Rukum East, which has a single electoral constituency, will see 14 candidates in the race, including Pushpa Kamal Dahal ‘Prachanda’, coordinator of the Communist Party of Nepal; Lilamani Gautam of CPN-UML; Kusum Devi Thapa of Nepali Congress; Lakhan Kumar Thapa of Rastriya Swatantra Party; Sandip Pun of the Progressive Democratic Party; and Roshan Shah of the Rastriya Prajatantra Party, among others. React to this post Hot Topics election Sarlahi march 5 voting voter sushile karki Balaram Sherpali Sherpali is an Onlinekhabar correspondent based in Rukum East. More From the Author Conversation New Old Popular Related News Sankh Village: A hidden gem of Rukum West 2 months ago Rukum East: 7 arrested on the charge of killing 2 minor girls 3 years ago Voting in Rukum East is yet to begin due to a tussle between Nepali Congress and Maoists 4 years ago Rukum East tipper fall kills 2 4 years ago Rukum East: 2 men nabbed on hostage-taking, rape charges 5 years ago Four killed in Rukum East jeep accident 8 years ago Most Read A new test for Oli as Balen gains ground in Jhapa-5 Holi colours and skin health: Risks and precautions 481 licensed firearms handed to administration in Madhesh These documents are valid for voting without a voter ID card Only 11 parties, 1,670 candidates open bank accounts for house polls Subscribe to our newsletter Subscribe to Onlinekhabar English to get notified of exclusive news stories. Editor's Pick Economy Budget ceiling set lower for FY 2083/84 as government moves to curb overspending trend 2 weeks ago Editor's Pick Nepal’s election campaign gains pace but manifestos remain absent 1 month ago Editor's Pick Meet Sharda Kumari Paudel, first female principal of Nepal’s oldest school 3 months ago Editor's Pick Fearless and unbound Nepali youth make historic wheelchair bungee jump 3 months ago Food & beverage Know what are yomaris and learn how to cook them on your own 3 months ago Also Read Politics Election highlights: Rabi salutes ballot box, Hark escorts mother to vote 2 minutes ago Politics Sarlahi CDO says minor disputes settled, situation scross district better than expected 2 hours ago Politics Prime Minister Sushila Karki casts her vote 5 hours ago Politics Voting begins across Nepal for House of Representatives Elections 5 hours ago Politics Inside election preparations in Jhapa-5 (Photos) 19 hours ago",9.0,2026-03-05T14:51:45.621888
1,rukum_east,रुकुम (पूर्वी भाग),Kusum Devi Thapa,कुसुम देवी थापा,OnlineKhabar EN,School Education Bill will be passed by June-end-Minister Pant,https://english.onlinekhabar.com/school-education-bill-will-be-passed-by-june-end-minister-pant.html,,"School Education Bill will be passed by June-end-Minister Pant Rastriya Samachar Samiti (RSS) Sunday, June 8, 2025 0 Comments Kathmandu, June 8 Minister for Education, Science and Technology, Raghuji Pant has claimed that the ‘Bill for the Amendment and Integration of the Law Related to School Education-2080’ will be passed by the Federal Parliament (House of Representatives) by Asar 15 (June 29). In his address to the ‘Consultation Programme on Early Childhood Development’ organised here today by the Federal MPs’ Coordination Group for Early Childhood Development, he shared ongoing arduous efforts to pass the bill within the stipulated date. The Minister further said, ‘All legitimate demands of the teachers would be addressed through the education bill. Work is on progress accordingly.” He said that the ministry is effortful on adjusting the posts and merging community schools to address the demands of teachers in the bill. Pant further noted that past agreements reached between the government and teachers would also be included in the bill as much as possible. “We need to amend the law timely in a way to address the needs of the time”, the minister added. “On the day the agreement was signed with the teachers, I publicly stated that the nine-point agreement is cash, and will come to force from the upcoming month of Shrawan (17 July),” Education Minister Pant noted. He mentioned that the government will adopt appropriate, scientific, and financially viable suggestions for the country’s education system reforms. “We must first remain clear how to include early childhood development within the education system and adopt policy for overall development of the children.” Amar Bahadur Thapa, chairperson of the House of Representatives, Education, Health and Information Committee, emphasized the need to improve education system based on priorities. Kusum Devi Thapa, chairperson of the Agriculture, Cooperatives and Natural Resources Committee, expressed the view that the government should also pay attention to other issues alongside the early development of children. Jiwan Pariyar, a member of the HoR, drew the attention of the education minister to the need for a separate law related to early childhood development for children’s holistic development. React to this post Hot Topics election Sarlahi march 5 voting voter sushile karki Rastriya Samachar Samiti (RSS) RSS is a government-run national news portal of Nepal. More From the Author Conversation New Old Popular Related News Two bills approved in the HoR 8 months ago School Education Bill: Consensus reached on 38 clauses 11 months ago HoR passes bills on Banking Offences and Legislation 1 year ago Most Read A new test for Oli as Balen gains ground in Jhapa-5 Holi colours and skin health: Risks and precautions 481 licensed firearms handed to administration in Madhesh These documents are valid for voting without a voter ID card Only 11 parties, 1,670 candidates open bank accounts for house polls Subscribe to our newsletter Subscribe to Onlinekhabar English to get notified of exclusive news stories. Editor's Pick Economy Budget ceiling set lower for FY 2083/84 as government moves to curb overspending trend 2 weeks ago Editor's Pick Nepal’s election campaign gains pace but manifestos remain absent 1 month ago Editor's Pick Meet Sharda Kumari Paudel, first female principal of Nepal’s oldest school 3 months ago Editor's Pick Fearless and unbound Nepali youth make historic wheelchair bungee jump 3 months ago Food & beverage Know what are yomaris and learn how to cook them on your own 3 months ago Also Read Politics Election highlights: Rabi salutes ballot box, Hark escorts mother to vote 2 minutes ago Politics Sarlahi CDO says minor disputes settled, situation scross district better than expected 2 hours ago Politics Prime Minister Sushila Karki casts her vote 5 hours ago Politics Voting begins across Nepal for House of Representatives Elections 5 hours ago Politics Inside election preparations in Jhapa-5 (Photos) 19 hours ago",8.1,2026-03-05T14:51:45.621890
1,rukum_east,रुकुम (पूर्वी भाग),Kusum Devi Thapa,कुसुम देवी थापा,Nepali Times,Nepalis Select Who To Elect,https://www.nepalitimes.com/news/nepalis-select-who-to-elect,,"Nepalis Select Who To Elect It is a partial poll when a quarter of the eligible electorate cannot vote? 27 February 2026 Sonia Awale 0 Photo: NT ARCHIVES Of the nearly 19 million eligible voters in next week’s election in Nepal, an estimated 5 million are abroad and cannot cast their ballots. Many others within Nepal must travel to their home districts, and might decide not to because of the cost. Flights into Kathmandu these days are full of global Nepalis returning just to vote, but almost as many are leaving for overseas jobs. Most of those coming or going are in the 20-40 age group, and a majority want Nepal to see a change in leadership. Bangladesh held an election this month in which citizens overseas could vote by mail. “Bangladesh made maximum use of technology not just for campaigning but also for polling itself. We could have also managed this, so people within Nepal did not have to travel to their home districts to vote,” says Mohna Ansari, former head of Nepal’s National Human Rights Commission who was an election observer in Bangladesh. A 3-day holiday has been declared so people can travel to their home constituencies to cast ballots. Even if there was not enough time to manage ballots for overseas Nepalis, it could have been done for Nepalis within Nepal. Former Chief Election Commissioner Bhojraj Pokharel reckons that physical voting in countries with a large Nepali diaspora would have been a logistical nightmare, but in the PR system, using electronic voting machines or paper ballot could have been piloted in some places. It is not possible to manage the entire voting process until we introduce the internet voting system. “First of all, there needs to be political will to bring the policy and be ready to undertake that level of investment and it is not a one-time cost,” Pokharel says. “A government formed by the GenZ could have atr least issed an ordinance ensuring this right, piloted out-of-country voting where possible, which could have built pressure for the future Parliament and the government. It would have given people hope. It is a lost opportunity.” All major political parties called for voting rights for global Nepalis in their manifestos, but these very leaders blocked legislation allowing it despite a 2017 Supreme Court ruling out of fear that it would be anti-incumbent. Why so late? Bangladesh delivered election results in just one day, but the final results of Nepal's last local polls in 2022 including that of Kathmandu constituencies took nearly a month. Acting Chief Election Commissioner Ram Prasad Bhandari said this week that the results of the First-Past-The-Post (FPTP) ballot counting would “likely” be published within 24 hours of the poll closing at 5PM on 5 March. But many are skeptical. “I wonder if we lack the capacity or know-how to announce results as quickly as possible,” says Mohna Ansari. Former Chief Election Commissioner Pokharel says manual ballot paper counting in Nepal is inherently slow because of the large numner of political parties and/or candidates on the ballot, the counting mechanism, the political behaviour of the candidates/parties and some managerial issues during counting. “Our present policy is to count all the ballot papers at the returning officers' officies, located at the district headquarters. It requires collecting ballot boxes safetly first. This takes time, and there have been cases of ballot boxes being damaged or stolen during transport. In a few highly difficult, geographically remote polling centres, we use a helicopter or transport. But sometimes, accommodating the party and candidates' representatives remains challenging,” explains Pokharel. A solution could be counting ballots at the very booths where they are cast. Another reason for the delay is simply the number of political parties, and the need for each ballot paper to be examined by booth representatives for consensus. In close races, the smallest difference can lead to tense situations, further delaying results, even though counting centres are protected by metal fencing so there is no disruption. After this, then it is the turn of Proportional Representation (PR) ballots to be counted. Weeks pass by the time the results of candidates and parties are tallied and verified. But the most common delay is because election officers think ballot counting is a nine-to-five job. “The efficiency of poll station officers is most important, and they are incentivised for this,” says Ansari, adding that counting can even start within an hour after voting closes. In remote areas, local resources could be mobilised to make counting quicker, but there is a crisis of trust, adds Ansari. That could be easily solved with electronic voting which the EC implemented in the 2008 polls but discontinued because political parties felt the machines could be hacked or manipulated. Sonia Awale writer Sonia Awale is the Editor of Nepali Times where she also serves as the health, science and environment cor",7.2,2026-03-05T14:51:45.621892
1,rukum_east,रुकुम (पूर्वी भाग),Kusum Devi Thapa,कुसुम देवी थापा,OnlineKhabar EN,"Chitwan-bound Hiace crashes near Thankot, one dead",https://english.onlinekhabar.com/chitwan-bound-hiace-crashes-near-thankot-one-dead.html,,"Chitwan-bound Hiace crashes near Thankot, one dead Onlinekhabar Monday, March 24, 2025 0 Comments Kathmandu, March 24 A Hiace coming from Chitwan lost control and crashed near Thankot, resulting in the death of one person. The deceased has been identified as 25-year-old Sabina Gurung. She passed away during treatment at the Trauma Center after sustaining injuries in the accident. In the same incident, 68-year-old Taradevi Kumal from Kalika Municipality-7, Chitwan, is reported to be in critical condition, according to the police. According to the police, 33-year-old Bindu Devkota from Chandragiri Municipality-15, Kathmandu, along with 40-year-old Anita Thapa, 37-year-old Mohit Gurung, 25-year-old Seema Kumal, 20-year-old Kusum Rai, and Bindu’s son, Dibyan Pokhrel (discharged), are currently receiving treatment. React to this post Hot Topics election Sarlahi march 5 voting voter sushile karki Conversation New Old Popular Related News 3 workers killed as wall collapses at feed factory in Chitwan 5 months ago 259 landless families receive land ownership certificates in Chitwan 6 months ago Six road accidents in Chitwan within 24 hours: One dead, 11 injured 1 year ago Chitwan ends Sudurpashchim’s unbeaten run in NPL 1 year ago Four dead in Chitwan as two vehicles collide head on 1 year ago 500 metric tons of honey remains unsold in Chitwan 1 year ago Most Read A new test for Oli as Balen gains ground in Jhapa-5 Holi colours and skin health: Risks and precautions 481 licensed firearms handed to administration in Madhesh These documents are valid for voting without a voter ID card Only 11 parties, 1,670 candidates open bank accounts for house polls Subscribe to our newsletter Subscribe to Onlinekhabar English to get notified of exclusive news stories. Editor's Pick Economy Budget ceiling set lower for FY 2083/84 as government moves to curb overspending trend 2 weeks ago Editor's Pick Nepal’s election campaign gains pace but manifestos remain absent 1 month ago Editor's Pick Meet Sharda Kumari Paudel, first female principal of Nepal’s oldest school 3 months ago Editor's Pick Fearless and unbound Nepali youth make historic wheelchair bungee jump 3 months ago Food & beverage Know what are yomaris and learn how to cook them on your own 3 months ago Also Read Politics Election highlights: Rabi salutes ballot box, Hark escorts mother to vote 2 minutes ago Politics Sarlahi CDO says minor disputes settled, situation scross district better than expected 2 hours ago Politics Prime Minister Sushila Karki casts her vote 5 hours ago Politics Voting begins across Nepal for House of Representatives Elections 5 hours ago Politics Inside election preparations in Jhapa-5 (Photos) 19 hours ago",6.9,2026-03-05T14:51:45.621893
