Constituency,DistrictEnglish,DistrictNepali,CandidateEnglish,CandidateNepali,Source,Title,URL,Snippet,Content,RelevanceScore,ScrapedAt
1,rukum_east,रुकुम (पूर्वी भाग),Kusum Devi Thapa,कुसुम देवी थापा,Ratopati,ओखलढुंगाको मानेभन्ज्याङका मतदाताले गरेनन् मतदान,https://www.ratopati.com/story/548144/voters-in-manebhanjyang-okhaldhunga-did-not-vote,,"ओखलढुंगाको मानेभन्ज्याङका मतदाताले गरेनन् मतदान रातोपाटी संवाददाता बिहीबार, २१ फागुन २०८२, ११ : १९ रातोपाटी संवाददाता बिहीबार, २१ फागुन २०८२ सारांश ओखलढुंगाको टोक्सेलस्थित मतदान केन्द्रका मतदाताहरूले मतदान बहिष्कार गरेका छन्। स्थानीयहरू प्रदेश सरकारले अस्पताल नबनाएको विरोधमा नो भोटमा उत्रिएका थिए। मुख्य निर्वाचन अधिकृतका अनुसार उक्त मतदान केन्द्रमा ७०१ मतदाता रहेका थिए। काठमाडौँ । ओखलढुंगाको एक मतदान केन्द्रका मतदाताहरुले मतदान बहिस्कार गरेका छन् । जिल्लाको मानेभञ्ज्याङ गाउँपालिका–७ को टोक्सेलस्थित मतदान केन्द्रमा मतदाताहरू मतादनमा सहभागी नभएको मुख्य निर्वाचन अधिकृत हरिप्रसाद कोइरालाले जानकारी दिए । स्थानीयले मत नहालेको खबरपछि आफू उक्त मतदान केन्द्र पुग्दा कोही पनि मतदाता उपस्थित नभएको पाइएको मुख्य निर्वाचन अधिकृत कोइरालाले बताए । ‘त्यहाँका मतदाता नो भोटमा उत्रिएको पाइयो । यो जानकारी आयोगका कार्यवहाक प्रमुख निर्वाचन आयुक्तलाई जानकारी गराइसकेको छु’, कोइरालाले रातोपाटीसँग भने । ‘जनप्रतिनिधिहरू गएर मुचुल्का गरिदिनुभएको छ । कर्मचारीहररू बसिरहनुभएको छ । भरे बेलुकासम्म कर्मचारीहररूको समानुपातिक जति भोट खस्छ त्यही मुचुल्का उठाएर पठाउँछौ’, मुख्य निर्वाचन अधिकृत कोइरालाले भने । मानेभञ्ज्याङ गाउँपालिकाका अध्यक्ष ज्ञानेन्द्र रूम्दालीले उक्त मतदान केन्द्रमा ७०१ जना मतदाता रहे पनि कोही पनि मतदानमा सहभागी नभएको बताए । उनका अनुसार प्रदेश सरकारले त्यस क्षेत्रमा प्रादेशिक अस्पताल बनाउने भने पनि काम सुरू नगरेको भन्दै स्थानीयहरू विरोधमा उत्रिएर मतदानमा सहभागी नभएको बताए । मतदान बहिस्कार ओखलढुंगा खबर पढेर तपाईलाई कस्तो महसुस भयो ? प्रतिक्रिया लेखकको बारेमा रातोपाटी संवाददाता ‘सबैको, सबैभन्दा राम्रो’ रातोपाटी डटकम। लेखकबाट थप भर्खरै तनहुँमा किरियापुत्रीद्वारा मतदान नुवाकोटमा दुई ठाउँबाट मतगणना हुने तस्बिरमा हेर्नुहोस् भक्तपुर बहुमुखी क्याम्पसको मतदान चितवनमा अहिलेसम्म ४५ प्रतिशत मतदान पहिलो पटक मत दिनेहरू भन्छन्– ‘हाम्रो भोट खेर जाँदैन’ कास्कीमा दिउँसो २ बजेसम्म ४३ प्रतिशत मत खस्यो, महिलाको सहभागिता उच्च ट्रेन्डिङ १. मतदान केन्द्रमा खटिएका कर्मचारी नै पक्राउ परेपछि... २. गन्तव्यमा नपुगी किन फर्कियो बालेन सवार हेलिकप्टर ? ३. बालेन चढेको हेलिकप्टर झापामा ल्यान्ड गरेन, काठमाडौँ फर्कँदै ४. श्रीलंका नजिकै इरानी युद्धपोतमा अमेरिकी आक्रमण, ८० नौसैनिकको मृत्यु ५. बुटवलमा पैसा बाँडेको आरोपमा एमाले र रास्वपाका कार्यकर्ताबिच झडप ६. कर्मचारीमाथि हातपात गर्न खोजेपछि दोलखामा हवाई फायर ७. चुनावमा खटिएका १२ जना सुरक्षाकर्मी र दुई मतदान अधिकृतको मृत्यु ८. राष्ट्रिय सुरक्षा परिषद्को बैठकले के गर्‍याे निर्णय ? छुटाउनुभयो कि ? निर्वाचन बहिष्कार गर्दै आन्दोलनको घोषणा प्रतिनिधि सभा उम्मेदवारले नै पार्टी छाडेपछि... प्रतिनिधि सभा उम्मेदवार पौडेलले फिर्ता लिए उम्मेदवारी रास्वपा र एमालेका कार्यकर्ताबिच झडप, २ जना घाइते धादिङमा बस दुर्घटना: १७ जनाको मृत्यु, २४ घाइते गौर झडप : ३ गाडी र दुई मोटरसाइकलमा आगजनी धादिङ बस दुर्घटनाः मृत्यु भएका १९ मध्ये ९ जनाको सनाखत (नामावलीसहित) बालेनलाई कारबाहीसहित नागरिकता रद्दको माग गर्दै गृह मन्त्रालयमा उजुरी",4.5,2026-03-05T14:51:45.621901
1,rukum_east,रुकुम (पूर्वी भाग),Kusum Devi Thapa,कुसुम देवी थापा,DDG (en1),Rukum East-1 : Province 5 - Nepal Election Latest Updates and Result ...,https://election.ekantipur.com/pradesh-5/district-rukumeast/constituency-1?lng=eng,"Rukum East-1 : Lumbini - Latest updates, results,candidatesand analysis ofNepalElection2082 Federal Parliament.","Rukum East-1 : Lumbini - Latest updates, results,candidatesand analysis ofNepalElection2082 Federal Parliament.",4.2,2026-03-05T14:51:45.621904
1,rukum_east,रुकुम (पूर्वी भाग),Kusum Devi Thapa,कुसुम देवी थापा,DDG (ne2),Nepal Press — Election Portal 2082,https://election.nepalpress.com/ne,"Nepal's most comprehensive election data portal. Get live election results, detailed candidate profiles, party performance analysis, and voting statistics for the Nepal Election 2082.","Nepal's most comprehensive election data portal. Get live election results, detailed candidate profiles, party performance analysis, and voting statistics for the Nepal Election 2082.",3.3,2026-03-05T14:51:45.621906
1,rukum_east,रुकुम (पूर्वी भाग),Kusum Devi Thapa,कुसुम देवी थापा,Nepali Times,Who is accountable for teacher-student relationships?,https://www.nepalitimes.com/here-now/who-is-accountable-for-teacher-student-relationships,,"Who is accountable for teacher-student relationships? “I was groomed, then I was sued for defamation,” says university alumna about a faculty member 26 February 2026 Subeksha Poudel 0 As a new student at Kathmandu University's Bachelor’s in Fine Arts in 2014, Mukta, 25 then, thought she must be doing something good when her teacher singled her out for attention. Her teacher was Sujan Chitrakar, then 40, the senior-most faculty, and a celebrated artist. Chitrakar has taught many contemporary Nepali artists and played an important role in establishing what is now KU’s Department of Art and Design (pictured). In between messages to Mukta about schoolwork, he texted to say he missed her or that she looked beautiful. She recalls being taken aback by a particular text that said: ‘I’m going for a bath. Do you want to see me?’ This was immediately followed with a cartoonish drawing with ‘Nude’ written next to it. Mukta awkwardly replied with a laugh, unsure how else to respond to such a message from her teacher, whom everyone placed on a pedestal. During Mukta’s first year in school, she says Chitrakar continued to shower her with gifts, asked her out for coffee, and insisted on driving her around. Once, when she was on his motorcycle returning home from university, Mukta remembers Chitrakar asking her to kiss him on his shoulder. When she refused, he apologised profusely, then asked if she was trying to seduce him. Seeing how shocked Mukta was, the teacher grabbed her hand and rubbed it against his chest, saying it was just a joke. A few weeks later, Chitrakar told Mukta that he couldn’t live without her and that they should be in a relationship. Having only looked up to him as a teacher, Mukta was uncertain about her feelings. When the earthquake struck in 2015, Chitrakar came to check on Mukta, and with her guards down, she felt perhaps his love was genuine. She didn’t doubt if she was safe with him. A decade later, still reeling from psychological trauma and career setbacks because of the relationship, Mukta is breaking her silence, accusing Chitrakar of abusing his power and grooming her. He had the duty of teaching and evaluating her, instead, Mukta says he used her for sex and emotional support from 2015 to 2019, while she was a student at KU. DEFAMATION SUIT She has been urging KU and art institutions to safeguard its students against sexual misconduct, but Chitrakar slammed a defamation lawsuit against her in January 2025 stating she damaged his reputation over what he described in court filings as a ""consensual relationship”. Earlier this week, the Kathmandu District court ruled that Chitrakar’s defamation claim could not be proven. We asked Chitrakar after the verdict about his conduct. His reply: “I’m sorry for the students who felt uncomfortable, but I did my duty well and good. It is ungrateful of the students to say that. Not everyone has to like me.” In answer to a query about his stance on intimate relationship between staff and student, he said: “For me it is a big no to date a student. Consequences arise and I am facing them now. Many staff-student intimate relations, including in my department, have ended in happy marriages. It’s a choice based on their personal and social ethics, and something to be determined by university policy.” Chitrakar said he now draws personal and professional boundaries with students, and says his relationship was not planned. He added, “Regardless of being a teacher I should not have dated a student because I'm a married man. If I was unmarried it would have been ok. While there is no definitive data on sexual misconduct in Nepal, interviews with more than 23 faculty and students from KU and TU for this story reveal that intimate staff-student relations are normalised, and in some cases even encouraged. Studies also suggest that sexual harassment is rampant in higher education in Nepal. The lack of university policies, power imbalance between staff and students, fear of retaliation, breaches of confidentiality, and the protection of perpetrators all contribute to impunity for sexual misconduct. Indeed, after students alleged sexual harassment, bullying, and homophobia against Yubaraj Sangroula of Kathmandu School of Law, and other faculty members in March 2025, the university filed slander lawsuits targeting a student whistleblower and alumni. Sangroula is contesting as an independent candidate in next week’s election from Jhapa-2. Seven years after complaints surfaced against retired lecturer Krishna Bhattachan for sexually harassing women students , Tribhuvan University, the government run institution, is still drafting its own policy and complaint procedure. And noted sculptor and former KU faculty member Gopal Kalapremi is yet to appear at Kathmandu District Court, after he was issued a summon on sexual harassment charges in 2024. Nepal’s Sexual Harassment at Workplace (Prevention) Act (2014) and the National Criminal (Code) Act, 2017 both forbid sexual relations",3.0,2026-03-05T14:51:45.621907
1,rukum_east,रुकुम (पूर्वी भाग),Kusum Devi Thapa,कुसुम देवी थापा,Nepali Times,West Asia war and Nepalis,https://www.nepalitimes.com/news/west-asia-war-and-nepalis,,"West Asia war and Nepalis Two million Nepalis live and work in the Gulf region that is the mainstay of country’s economy through remittances 28 February 2026 Nepali Times 0 Passengers at Kathmandu airport waiting for flights on Saturday evening. On Saturday, Iran retaliated with missile strikes on Abu Dhabi, Dubai, Bahrain and Qatar, a region where there are an estimated 2 million Nepalis working to send money home. In addition, thousands of Nepalis were preparing to board flights to Kathmandu from West Asian cities this weekend to vote in the 5 March election. Many are said to be stranded at various aviation hubs. A Qatar Airways flight from Doha took off just before the air space was closed, while Air Arabia and Kuwait Airways have diverted or cancelled flights. Nepalis in the West Asian region said things were relatively calm where they were, although some heard loud explosions at about noon local time. In Dubai, some thought they were Ramadan fireworks. In Kuwait, nearly 2,000 Nepalis working in the US military base as security guards and cleaners were evacuated before the strikes. In Bahrain where the US Fifth Fleet naval base is located and which was hit by two Iranian missiles, workers contacted by Nepali Times said the situation was under control and the authorities had told everyone to stay indoors and not use highways. The conflict also coincided with the beginning of Nepal’s trekking and mountaineering season, and tourists were either on their way or planning to leave European and North American cities for Himalayan hikes. Most of them transit through Doha, Dubai or Kuwait and all three airports are closed. Turkish Airlines flights via Istanbul are still operating. Qatar and UAE airspace closed. Credit: Flightradar24 However, the main impact for the world could be a spike in the price of petroleum products if the strategic Strait of Hormuz is blocked. China relies on Iranian oil for their refineries, and Nepal could be affected indirectly if the economies of its neighbours are hit. Nepal imports all its diesel, petrol, LPG and aviation fuel from India which sources it mainly from the Gulf, and until recently from Russia. Petroleum makes up 25% of the value of all imports, and that is more than Nepal earns from all its exports. Saudi Arabia this year overtook the UAE as the main destination for Nepali workers, with the number now totalling 400,000. There are said to be as many in the UAE, and another 350,000 in Qatar. There are another 100,000 mostly women in Kuwait, and 50,000 each in Oman and Bahrain. Iran retaliated with missile strikes on Abu Dhabi, Dubai, Bahrain and Qatar on Saturday. Nepal receives nearly $11 billion a year in remittances from overseas Nepalis (not counting India) through official channels, although the total is said to be much more.  This makes up more than a quarter of Nepal’s GDP equivalent — one of the highest proportions in the world. More than half of the overseas remittances to Nepal comes from its workers in the Gulf, and it is the mainstay of the country’s economy. Nepalis in Saudi Arabia, Qatar and the UAE alone send home more than $3 billion a year, much of that helping support their families back home. An average Nepali worker in the Gulf sends home nearly $2,500 a year, and this is spent mainly for household supplies, children’s education and healthcare. There are also an estimated 7,000 Nepali caregivers and healthcare workers in Israel, and most of them are women. The Nepal Embassy has asked Nepalis in Israel to take caution and move to bomb shelters. Tags overseas Nepalis West Asia conflict Gulf countries",2.7,2026-03-05T14:51:45.621909
1,rukum_east,रुकुम (पूर्वी भाग),Kusum Devi Thapa,कुसुम देवी थापा,Reddit/r/Nepal,[r/Nepal] My Thoughts: Directly Elected PM Is Not a good option for Nepal,https://www.reddit.com/r/Nepal/comments/1nt9bc9/my_thoughts_directly_elected_pm_is_not_a_good/,↑83  💬55,"I don’t think directly elected Prime Minister is the right option for Nepal. The reality is, Nepali people are so easily influenced—like sheep. Just look at how many blindly believe whatever Durga Prasai says. If a system of directly elected PM existed, someone like him could manipulate the masses and climb to power, no matter how dangerous or unfit he might be. And if not him, then what about other bad person who could exploit the same system?

Instead of copying Western or Indian political models, Nepal should create its own unique system—something that actually works for the mindset and context of our society. Honestly, what I see right now makes me feel like Nepal doesn’t need more “democracy,” it needs a strong leader, maybe even a dictator, to straighten things out. Because at this point, people are not supporting capable leaders like Balen; instead, they’re busy spreading hate and propaganda against him. And the sad part? The public is actually believing it—without any research, without any critical thinking.

It’s the same attitude everywhere. People complain about modern initiatives like *Shark Tank Nepal* just because the show uses English. But it’s literally a business show, and business everywhere uses English. Why is this even a problem? English is an international language—if you can’t accept that, how do you expect to compete in the global economy?

This is why I believe directly elected PM is not suitable for Nepal right now. Until the mindset of the people changes, such a system will only invite corruption, manipulation, and chaos.

This is my thoughts and I am on democratic country and I can share my thoughts. Thank you.

Why have election in the first place then if people are sheep. The elected sheeps  elect the biggest sheep to the heart of the government then.
---
Directly electing a PM in Nepal sounds great on paper, but given how easily people are swayed by personalities and propaganda, it could backfire. A system needs to fit the mindset of the society, not just copy foreign models. Until political awareness and critical thinking improve, directly elected leadership could do more harm than good.
---
we need to have a nice check and balance system, whatever the selection modality is
---
i think the main point of directly elected PM is to make government stable. If the gov didn't do good work, people can change it next time.
---
Party Reform xahi main debate hunu parne. Yo nagare samma Direct elect PM khutta ma bancharo hanne kaam ho.
---
Using 3 quotes from one of my fav book to explain why balen is getting hate

• “Courage is the only virtue you cannot fake. Real leaders display it by putting their own necks on the line.”

• “The most important aspect of leadership is having skin in the game, taking personal risk for your decisions. A leader who risks nothing isn’t a leader but a bureaucrat.”

• “A leader is someone who would rather be harmed than see others harmed because of his decisions.”
---
Directly elected pm is Maoist ideology. Given their support and popularity maoist wish to use in their favour. And create dictatorship. I don’t know why people demand all these things without knowing the positive and negative aspects of these things.",2.4,2026-03-05T14:51:45.621910
1,rukum_east,रुकुम (पूर्वी भाग),Kusum Devi Thapa,कुसुम देवी थापा,DDG (ne1),रुकुम (पूर्वी भाग) - १ :: Nepal Election 2082 | Baahrakhari Candidate ...,https://election.baahrakhari.com/kshetra-detail/131,"Get real‑time election insights for Nepal's 2082 General Election. See candidate lists, party details, district breakdowns and key updates in one place.","Get real‑time election insights for Nepal's 2082 General Election. See candidate lists, party details, district breakdowns and key updates in one place.",2.1,2026-03-05T14:51:45.621911
1,rukum_east,रुकुम (पूर्वी भाग),Kusum Devi Thapa,कुसुम देवी थापा,Reddit/r/Nepal,[r/Nepal] Its my opinion only. But Gagan Thapa was never a leader for Nepal and Nepali,https://www.reddit.com/r/Nepal/comments/1nfzvpt/its_my_opinion_only_but_gagan_thapa_was_never_a/,↑21  💬5,"Yaar yetro.bhaisako. Neta haru ko ghar ma paisa paisak le bhare ko kota cha. Kati brastachar raicha dekhi sakyo. But Gagan Thapa (and other jhole too) are not talking about this. As if its a normal thing. Aaile pani tesko video hru ma khali parti parti parti matra cha. aaba Yo sanga pani tannai paiso chaina bhanna ta sakinna ni. Next Election ma Yo aaile jati pani politically active chan. ti sabai lai uthnai dinu hunna.

GAGAN chor needs to be taught a lesson as well. So do all the other party heads. These old fools have made a circus of this nation.
---
Gagan Thapa, Prachanda, Rabi, Gyanendra, and every other politician tied to corrupt parties or institutions should be permanently barred from engaging in political activities.
---
Gangan Thapa had so much potential. Dherai manxey le aas garkeo theye but jhaile maile garna sakina matra vanyo. Usle party vanda mathi jana khaile sakena. He didnt even condemn his party's imvolvement in Sep 8. Yesto hutihara lai k vannu. He will surely be face of Nepali Congress now.
---
chor neta haru lai JAIL halnu parchha   
STAY AWAKE -&gt;&gt; अब सबै नेपाली जनता एक भएर धेरै काम गर्नु छ 

कार्यकारी ब्यबस्था गर्ने तिर लागौं ✊",2.1,2026-03-05T14:51:45.621913
1,rukum_east,रुकुम (पूर्वी भाग),Kusum Devi Thapa,कुसुम देवी थापा,Reddit/r/Nepal,"[r/Nepal] Nepal has plunged into a political crisis and renewed instability after President Bidhya Devi Bhandari dissolved parliament at the request of Prime Minister KP Sharma Oli and announced general elections would be held in April and May next year, more than a year ahead of schedule",https://www.reddit.com/r/Nepal/comments/kjtk0o/nepal_has_plunged_into_a_political_crisis_and/,↑9  💬2,"Oh no...  

Anyways
---
Right to no vote kam lagxa jasto xa. Sabailey yo sewa praying garey kasto paristhiti utpanna huney hola.",2.1,2026-03-05T14:51:45.621915
1,rukum_east,रुकुम (पूर्वी भाग),Kusum Devi Thapa,कुसुम देवी थापा,DDG (ne1),हेभीवेट उम्मेदवार हराउने योजनामा कुसुम,https://election.onlinekhabar.com/central-candidate/kusum-devi-thapa,नेपाली कांग्रेसबाट एक मात्रनिर्वाचनक्षेत्र रहेको रूकूम पूर्वमा पार्टी केन्द्रीय सदस्य कुशुमदेवीथापामगरले उम्मेदवारी दिएकी ...,नेपाली कांग्रेसबाट एक मात्रनिर्वाचनक्षेत्र रहेको रूकूम पूर्वमा पार्टी केन्द्रीय सदस्य कुशुमदेवीथापामगरले उम्मेदवारी दिएकी ...,1.8,2026-03-05T14:51:45.621916
