Constituency,DistrictEnglish,DistrictNepali,CandidateEnglish,CandidateNepali,Source,Title,URL,Snippet,Content,RelevanceScore,ScrapedAt
1,rukum_east,रुकुम (पूर्वी भाग),Kusum Devi Thapa,कुसुम देवी थापा,OnlineKhabar EN,A new test for Oli as Balen gains ground in Jhapa-5,https://english.onlinekhabar.com/oli-vs-balen-gains-ground-in-jhapa-5.html,,"A new test for Oli as Balen gains ground in Jhapa-5 Prasun Sangroula Friday, February 27, 2026 0 Comments Jhapa: As Nepal approaches its parliamentary elections on March 5, the political atmosphere across the country has grown increasingly charged. Specifically in  Jhapa-5, the contest appears particularly intense because it features K.P. Sharma Oli, chairman of the Communist Party of Nepal (Unified Marxist–Leninist), against Balendra Shah, widely known as Balen, a senior leader of the Rastriya Swatantra Party (RSP). Both men are viewed as potential prime ministerial contenders if their parties secure enough seats in Parliament. Jhapa-5 has long been considered Oli’s political stronghold. With the exception of the elections held around the 2006 people’s movement, he has consistently won here. Yet this year, the mood appears different. From tea shops and neighbourhood gatherings to street vendors and rickshaw drivers, conversations suggest that  Oli’s victory is no longer viewed as inevitable. When Balen arrived in Damak on January 20 to file his candidacy , an unusually large crowd gathered at the town square, a scene not witnessed for other challengers in previous elections. Since that day, his presence in the constituency has been difficult to ignore. Who ultimately prevails will be determined only after ballots are counted. But Balen’s growing visibility has become a central feature of the campaign. A long-time UML party activist in Jhapa-5, speaking on condition of anonymity, said he had decided to vote for Balen in the direct race. “We supported K.P. Oli for many years, but now we have little hope left,” he says. “With someone new, at least there is a possibility of change.” The activist, who lives in an informal settlement, said Oli had repeatedly promised land ownership certificates to residents but failed to deliver. “We stood by him continuously. But this time we will not accept what we see as false assurances.” Such defections are unusual in a constituency widely regarded as a UML bastion. The activist added that while he would vote for Balen in the first-past-the-post race, he would still support UML under the proportional representation system. Another local party worker from the Nepali Congress, also speaking anonymously, described Balen’s influence as “genuinely strong.” He said he planned to vote for his party under proportional representation but would support the Rastriya Swatantra Party in the direct contest. “From what we see on the ground, either Balen or the Rastriya Swatantra Party could come out on top,” he says, adding that the Congress candidate appeared comparatively weak. “This constituency has trusted Oli many times, but people feel the expected results did not follow.” Local grievances extend beyond partisan politics. Landowners affected by the proposed East–West railway project say their property has been frozen for years without compensation. Some residents blame Oli for failing to resolve the issue during his tenure. The extent to which K.P. Sharma Oli has been going door to door seeking votes during this campaign suggests that the situation in Jhapa-5 is different from previous elections. The kinds of questions he has faced from voters while canvassing further indicate that he may encounter significant challenges in securing victory this time. “Although he has not appeared equally active in the nationwide campaign, Oli’s heightened focus on Jhapa-5 signals that he is facing a tougher contest here compared with past years,” says Sagar Siwakoti, a political analyst based in Jhapa. Balen’s influence in Jhapa-5 has grown so markedly that his door-to-door events now draw unusually large crowds, at times making it difficult to carry out the campaign effectively. Development has not been absent from Jhapa-5, said Madan Rajbanshi, Editor in Chief of the local media Gauriganj Darpan . But he noted that many projects have been concentrated in Damak, leaving areas such as Gauradaha and Gauriganj feeling neglected. Kankai River Bridge. Photo: Prasun Sangroula A bridge over the Kankai River along the Hulaki Highway has remained incomplete for 14 years. Another bridge over the Ratuwa River was finished only this year, after 17 years of delays and sustained public pressure. In the 2017 election campaign, Oli pledged to modernise the customs office in Gauriganj, but little progress has been made since. In parts of Gauradaha, unresolved land-mapping issues dating back decades have prevented property owners from securing bank loans or conducting formal transactions. Oli has repeatedly promised a solution, but the matter remains unsettled. “These are the reasons many voters in Gauradaha-4 and parts of Ward 5 may not support Oli this time,” Rajbanshi said. Santosh Dulal, a Jhapa-5 resident who is currently working closely with Balen, said public frustration with established leaders has deepened. “People are disillusioned with traditional politicians,” he says. “They feel their basic needs have ",6.9,2026-03-05T14:51:45.621894
1,rukum_east,रुकुम (पूर्वी भाग),Kusum Devi Thapa,कुसुम देवी थापा,DDG (en1),Rukum Constituency 1 - House of Representatives Election 2082 Results ...,https://election.nepsebajar.com/en/pratinidhi/157/rukum-1-election-result-live-election-2082,"Liveelectionresults for Rukum Constituency No. 1 in theNepalFederal Parliament (House of Representatives)Election2082. View vote counts,candidatedetails, and constituency analysis.","Liveelectionresults for Rukum Constituency No. 1 in theNepalFederal Parliament (House of Representatives)Election2082. View vote counts,candidatedetails, and constituency analysis.",6.6,2026-03-05T14:51:45.621896
1,rukum_east,रुकुम (पूर्वी भाग),Kusum Devi Thapa,कुसुम देवी थापा,Ratopati,एमाले उम्मेदवार नेम्वाङले गरे मतदान,https://www.ratopati.com/story/548133/uml-candidate-nembang-casts-his-vote,,"एमाले उम्मेदवार नेम्वाङले गरे मतदान रातोपाटी संवाददाता बिहीबार, २१ फागुन २०८२, १० : ४४ रातोपाटी संवाददाता बिहीबार, २१ फागुन २०८२ काठमाडौँ । इलाम–२ बाट प्रतिनिधिसभा सदस्य पदको उम्मेदवार सुहाङ नेम्वाङले मतदान गरेका छन् । उनले मरब क्याम्पस इलाम मतदान केन्द्रबाट मतदान गरेका हुन् । एमाले उम्मेदवार नेम्वाङले गरे मतदान खबर पढेर तपाईलाई कस्तो महसुस भयो ? प्रतिक्रिया लेखकको बारेमा रातोपाटी संवाददाता ‘सबैको, सबैभन्दा राम्रो’ रातोपाटी डटकम। लेखकबाट थप भर्खरै तनहुँमा किरियापुत्रीद्वारा मतदान नुवाकोटमा दुई ठाउँबाट मतगणना हुने तस्बिरमा हेर्नुहोस् भक्तपुर बहुमुखी क्याम्पसको मतदान चितवनमा अहिलेसम्म ४५ प्रतिशत मतदान पहिलो पटक मत दिनेहरू भन्छन्– ‘हाम्रो भोट खेर जाँदैन’ कास्कीमा दिउँसो २ बजेसम्म ४३ प्रतिशत मत खस्यो, महिलाको सहभागिता उच्च ट्रेन्डिङ १. मतदान केन्द्रमा खटिएका कर्मचारी नै पक्राउ परेपछि... २. गन्तव्यमा नपुगी किन फर्कियो बालेन सवार हेलिकप्टर ? ३. बालेन चढेको हेलिकप्टर झापामा ल्यान्ड गरेन, काठमाडौँ फर्कँदै ४. श्रीलंका नजिकै इरानी युद्धपोतमा अमेरिकी आक्रमण, ८० नौसैनिकको मृत्यु ५. बुटवलमा पैसा बाँडेको आरोपमा एमाले र रास्वपाका कार्यकर्ताबिच झडप ६. कर्मचारीमाथि हातपात गर्न खोजेपछि दोलखामा हवाई फायर ७. चुनावमा खटिएका १२ जना सुरक्षाकर्मी र दुई मतदान अधिकृतको मृत्यु ८. राष्ट्रिय सुरक्षा परिषद्को बैठकले के गर्‍याे निर्णय ? छुटाउनुभयो कि ? निर्वाचन बहिष्कार गर्दै आन्दोलनको घोषणा प्रतिनिधि सभा उम्मेदवारले नै पार्टी छाडेपछि... प्रतिनिधि सभा उम्मेदवार पौडेलले फिर्ता लिए उम्मेदवारी रास्वपा र एमालेका कार्यकर्ताबिच झडप, २ जना घाइते धादिङमा बस दुर्घटना: १७ जनाको मृत्यु, २४ घाइते गौर झडप : ३ गाडी र दुई मोटरसाइकलमा आगजनी धादिङ बस दुर्घटनाः मृत्यु भएका १९ मध्ये ९ जनाको सनाखत (नामावलीसहित) बालेनलाई कारबाहीसहित नागरिकता रद्दको माग गर्दै गृह मन्त्रालयमा उजुरी",5.7,2026-03-05T14:51:45.621897
1,rukum_east,रुकुम (पूर्वी भाग),Kusum Devi Thapa,कुसुम देवी थापा,Ratopati,कांग्रेस नेता डा.कोइरालाद्वारा मतदान,https://www.ratopati.com/story/548169/congress-leader-dr-koirala-casts-his-vote,,"कांग्रेस नेता डा.कोइरालाद्वारा मतदान रासस बिहीबार, २१ फागुन २०८२, १२ : ११ फाइल तस्बिर रासस बिहीबार, २१ फागुन २०८२ मोरङ ।  नेपाली कांग्रेसका डा.शेखर कोइरालाले विराटनगर महानगरपालिका–७ स्थित आदर्श माविमा रहेको मतदान केन्द्रबाट मतदान गरेका छन् । मोरङ क्षेत्र नं ६ का उम्मेदवारसमेत रहनुभएका डा शेखर कोइरालाले मतदानपछि पत्रकारसँग संक्षिप्त कुराकानी गर्दै सबैको आपसी सहकार्य र समन्वयबाट मुलुक निर्माणमा लाग्नुपर्ने धारणा राखे । डा.शेखर कोइराला खबर पढेर तपाईलाई कस्तो महसुस भयो ? प्रतिक्रिया लेखकको बारेमा रासस राष्ट्रिय समाचार समिति नेपालकाे  सरकारी समाचार संस्था हाे । लेखकबाट थप भर्खरै तनहुँमा किरियापुत्रीद्वारा मतदान नुवाकोटमा दुई ठाउँबाट मतगणना हुने तस्बिरमा हेर्नुहोस् भक्तपुर बहुमुखी क्याम्पसको मतदान चितवनमा अहिलेसम्म ४५ प्रतिशत मतदान पहिलो पटक मत दिनेहरू भन्छन्– ‘हाम्रो भोट खेर जाँदैन’ कास्कीमा दिउँसो २ बजेसम्म ४३ प्रतिशत मत खस्यो, महिलाको सहभागिता उच्च ट्रेन्डिङ १. मतदान केन्द्रमा खटिएका कर्मचारी नै पक्राउ परेपछि... २. गन्तव्यमा नपुगी किन फर्कियो बालेन सवार हेलिकप्टर ? ३. बालेन चढेको हेलिकप्टर झापामा ल्यान्ड गरेन, काठमाडौँ फर्कँदै ४. श्रीलंका नजिकै इरानी युद्धपोतमा अमेरिकी आक्रमण, ८० नौसैनिकको मृत्यु ५. बुटवलमा पैसा बाँडेको आरोपमा एमाले र रास्वपाका कार्यकर्ताबिच झडप ६. कर्मचारीमाथि हातपात गर्न खोजेपछि दोलखामा हवाई फायर ७. चुनावमा खटिएका १२ जना सुरक्षाकर्मी र दुई मतदान अधिकृतको मृत्यु ८. राष्ट्रिय सुरक्षा परिषद्को बैठकले के गर्‍याे निर्णय ? छुटाउनुभयो कि ? निर्वाचन बहिष्कार गर्दै आन्दोलनको घोषणा प्रतिनिधि सभा उम्मेदवारले नै पार्टी छाडेपछि... प्रतिनिधि सभा उम्मेदवार पौडेलले फिर्ता लिए उम्मेदवारी रास्वपा र एमालेका कार्यकर्ताबिच झडप, २ जना घाइते धादिङमा बस दुर्घटना: १७ जनाको मृत्यु, २४ घाइते गौर झडप : ३ गाडी र दुई मोटरसाइकलमा आगजनी धादिङ बस दुर्घटनाः मृत्यु भएका १९ मध्ये ९ जनाको सनाखत (नामावलीसहित) बालेनलाई कारबाहीसहित नागरिकता रद्दको माग गर्दै गृह मन्त्रालयमा उजुरी",5.1,2026-03-05T14:51:45.621899
1,rukum_east,रुकुम (पूर्वी भाग),Kusum Devi Thapa,कुसुम देवी थापा,Ratopati,"उदयपुरमा मोटरसाइकल रुखमा ठोक्किँदा एकको मृत्यु, दुई जना गम्भीर घाइते",https://www.ratopati.com/story/548190/one-dead-two-seriously-injured-after-motorcycle-crashes-into-tree-in-udayapur,,"उदयपुरमा मोटरसाइकल रुखमा ठोक्किँदा एकको मृत्यु, दुई जना गम्भीर घाइते रातोपाटी संवाददाता बिहीबार, २१ फागुन २०८२, १२ : ५१ रातोपाटी संवाददाता बिहीबार, २१ फागुन २०८२ सारांश उदयपुरको चौदण्डीगढीमा मोटरसाइकल दुर्घटना हुँदा एक जनाको मृत्यु भएको छ। दुर्घटनामा दुई जना गम्भीर घाइते भएका छन् र उनीहरूको विराटनगरमा उपचार भइरहेको छ। प्रहरीले घटनाको अनुसन्धान गरिरहेको छ, तीव्र गति र तीन जना सवार हुनु दुर्घटनाको कारण हुनसक्ने अनुमान छ। उदयपुर । उदयपुरको चौदण्डीगढी नगरपालिकामा आज बिहान मोटरसाइकल दुर्घटना हुँदा एक जनाको मृत्यु भएको छ भने दुई जना गम्भीर घाइते भएका छन् । मदन भण्डारी लोकमार्ग अन्तर्गत चौदण्डीगढी नगरपालिका वडा नं। १० भिमा खण्डमा गाईघाटबाट बेल्टारतर्फ जाँदै गरेको प्र.०१-०५-००२ प १८२७ नम्बरको मोटरसाइकल अनियन्त्रित भई दुर्घटना भएको हो । तीव्र गतिमा रहेको मोटरसाइकल सडकको उत्तरतर्फ रहेको सखुवाको रुखमा ठोक्किँदा मोटरसाइकल चालक चौदण्डीगढी नगरपालिका–५ सिवाई बस्ने १८ वर्षीय समिर चौधरीको मृत्यु भएको प्रहरीले जनाएको छ । दुर्घटनामा गम्भीर घाइते भएका चौधरीलाई तत्काल उद्धार गरी नगर अस्पताल बेल्टार लगिएकोमा अस्पताल पुर्‍याउनासाथ चिकित्सकले मृत घोषणा गरेका थिए । सोही दुर्घटनामा परी मोटरसाइकलमा सवार अन्य दुई जना गम्भीर घाइते भएका छन् । घाइते हुनेहरूमा चौदण्डीगढी–५ सिवाई बस्ने १८ वर्षीय मौसम चौधरी र सोही ठाउँका २३ वर्षीय अशोक चौधरी रहेका छन् । घाइते दुवै जनालाई नगर अस्पतालमा सामान्य उपचारपछि थप उपचारका लागि विराटनगरस्थित सुविधा सम्पन्न अस्पतालमा रेफर गरिएको छ । बिहान करिब ११:०० बजे भएको उक्त दुर्घटनाको विषयमा इलाका प्रहरी कार्यालय बेल्टारबाट खटिएको प्रहरी टोलीले थप अनुसन्धान गरिरहेको जनाएको छ । एउटै मोटरसाइकलमा तीन जना सवार रहेकाले अनियन्त्रित भई दुर्घटना भएको हुनसक्ने प्रारम्भिक अनुमान गरिएको छ । घाइते मोटरसाइकल दुर्घटना उदयपुर दुर्घटना खबर पढेर तपाईलाई कस्तो महसुस भयो ? प्रतिक्रिया लेखकको बारेमा रातोपाटी संवाददाता ‘सबैको, सबैभन्दा राम्रो’ रातोपाटी डटकम। लेखकबाट थप भर्खरै तनहुँमा किरियापुत्रीद्वारा मतदान नुवाकोटमा दुई ठाउँबाट मतगणना हुने तस्बिरमा हेर्नुहोस् भक्तपुर बहुमुखी क्याम्पसको मतदान चितवनमा अहिलेसम्म ४५ प्रतिशत मतदान पहिलो पटक मत दिनेहरू भन्छन्– ‘हाम्रो भोट खेर जाँदैन’ कास्कीमा दिउँसो २ बजेसम्म ४३ प्रतिशत मत खस्यो, महिलाको सहभागिता उच्च ट्रेन्डिङ १. मतदान केन्द्रमा खटिएका कर्मचारी नै पक्राउ परेपछि... २. गन्तव्यमा नपुगी किन फर्कियो बालेन सवार हेलिकप्टर ? ३. बालेन चढेको हेलिकप्टर झापामा ल्यान्ड गरेन, काठमाडौँ फर्कँदै ४. श्रीलंका नजिकै इरानी युद्धपोतमा अमेरिकी आक्रमण, ८० नौसैनिकको मृत्यु ५. बुटवलमा पैसा बाँडेको आरोपमा एमाले र रास्वपाका कार्यकर्ताबिच झडप ६. कर्मचारीमाथि हातपात गर्न खोजेपछि दोलखामा हवाई फायर ७. चुनावमा खटिएका १२ जना सुरक्षाकर्मी र दुई मतदान अधिकृतको मृत्यु ८. राष्ट्रिय सुरक्षा परिषद्को बैठकले के गर्‍याे निर्णय ? छुटाउनुभयो कि ? निर्वाचन बहिष्कार गर्दै आन्दोलनको घोषणा प्रतिनिधि सभा उम्मेदवारले नै पार्टी छाडेपछि... प्रतिनिधि सभा उम्मेदवार पौडेलले फिर्ता लिए उम्मेदवारी रास्वपा र एमालेका कार्यकर्ताबिच झडप, २ जना घाइते धादिङमा बस दुर्घटना: १७ जनाको मृत्यु, २४ घाइते गौर झडप : ३ गाडी र दुई मोटरसाइकलमा आगजनी धादिङ बस दुर्घटनाः मृत्यु भएका १९ मध्ये ९ जनाको सनाखत (नामावलीसहित) बालेनलाई कारबाहीसहित नागरिकता रद्दको माग गर्दै गृह मन्त्रालयमा उजुरी",4.5,2026-03-05T14:51:45.621900
