Constituency,DistrictEnglish,DistrictNepali,CandidateEnglish,CandidateNepali,Source,Title,URL,Snippet,Content,RelevanceScore,ScrapedAt
1,gorkha,गोरखा,Kedar Mani Khanal,केदार मणी खनाल,DDG (ne1),केदार मणी खनाल :: Nepal Election 2082 | Thaha Khabar Candidate ...,https://election.thahakhabar.com/candidate-detail/2258,"प्रतिनिधिसभानिर्वाचन२०८२ शनिबार, फागुन ९, २०८२ चर्चित उम्मेद्वार राजनीतिक दलउम्मेदवारसमाचार गृहपृष्ठउम्मेदवारकेदारमणीखनाल","प्रतिनिधिसभानिर्वाचन२०८२ शनिबार, फागुन ९, २०८२ चर्चित उम्मेद्वार राजनीतिक दलउम्मेदवारसमाचार गृहपृष्ठउम्मेदवारकेदारमणीखनाल",30.0,2026-03-05T14:54:57.220013
1,gorkha,गोरखा,Kedar Mani Khanal,केदार मणी खनाल,DDG (ne1),केदार मणी खनाल :: Nepal Election 2082 | Baahrakhari Candidate & Results Hub,https://election.baahrakhari.com/candidate-detail/2258,प्रदेश: गण्डकी जिल्ला:गोरखानिर्वाचनक्षेत्र:गोरखा- १ पार्टी: राष्ट्रिय प्रजातन्त्र पार्टीगोरखा- १ का अन्य उमेदवारहरु,प्रदेश: गण्डकी जिल्ला:गोरखानिर्वाचनक्षेत्र:गोरखा- १ पार्टी: राष्ट्रिय प्रजातन्त्र पार्टीगोरखा- १ का अन्य उमेदवारहरु,22.0,2026-03-05T14:54:57.220030
1,gorkha,गोरखा,Kedar Mani Khanal,केदार मणी खनाल,DDG (ne1),केदार मणी खनाल - Rastriya Prajatantra Party (RPP),https://rpp.org.np/teams/kedar-mani-khanal,"केदारमणीखनाल,गोरखाक्षेत्र नं. १ को उम्मेदवार, इमानदार नेतृत्व र जनप्रतिबद्ध, विकास, सुशासन र स्थायित्वको नयाँ अध्याय ल्याउने ...","केदारमणीखनाल,गोरखाक्षेत्र नं. १ को उम्मेदवार, इमानदार नेतृत्व र जनप्रतिबद्ध, विकास, सुशासन र स्थायित्वको नयाँ अध्याय ल्याउने ...",16.0,2026-03-05T14:54:57.220033
1,gorkha,गोरखा,Kedar Mani Khanal,केदार मणी खनाल,DDG (ne1),ChangeNepal - केदार मणी खनाल,https://www.changenepal.org/election/candidate/kedar-mani-khanal/election-2082,"ChangeNepal is a review platform that allows citizens to track the political records of parties, businesses, and individuals, and leave reviews and ratings based on their experiences. Join the discussion and make your voice heard for a more transparent and accountable society.","ChangeNepal is a review platform that allows citizens to track the political records of parties, businesses, and individuals, and leave reviews and ratings based on their experiences. Join the discussion and make your voice heard for a more transparent and accountable society.",10.0,2026-03-05T14:54:57.220035
1,gorkha,गोरखा,Kedar Mani Khanal,केदार मणी खनाल,DDG (ne1),गोरखा / क्षेत्र नं. १,https://election.nepsebajar.com/pratinidhi/96/gorkha-1-election-result-live-election-2082,"Live election results for Gorkha Constituency No. 1 in the Nepal Federal Parliament (House of Representatives) Election 2082. View vote counts, candidate details, and constituency analysis. The voter age breakdown includes: 9,549 (18-25), 42,349 (26-40), 38,144 (41-60), and 30,465 (61+).","Live election results for Gorkha Constituency No. 1 in the Nepal Federal Parliament (House of Representatives) Election 2082. View vote counts, candidate details, and constituency analysis. The voter age breakdown includes: 9,549 (18-25), 42,349 (26-40), 38,144 (41-60), and 30,465 (61+).",7.2,2026-03-05T14:54:57.220037
1,gorkha,गोरखा,Kedar Mani Khanal,केदार मणी खनाल,DDG (ne2),उम्मेदवारहरु / प्रतिनिधि सभा निर्वाचन २०८२,https://election.ratopati.com/candidates,"Ratopati Nepal Election 2082 Portal - View House of Representatives election candidates, political parties, constituencies, voter statistics, and latest election results across Nepal.","Ratopati Nepal Election 2082 Portal - View House of Representatives election candidates, political parties, constituencies, voter statistics, and latest election results across Nepal.",7.2,2026-03-05T14:54:57.220040
1,gorkha,गोरखा,Kedar Mani Khanal,केदार मणी खनाल,Nepali Times,Nepalis Select Who To Elect,https://www.nepalitimes.com/news/nepalis-select-who-to-elect,,"Nepalis Select Who To Elect It is a partial poll when a quarter of the eligible electorate cannot vote? 27 February 2026 Sonia Awale 0 Photo: NT ARCHIVES Of the nearly 19 million eligible voters in next week’s election in Nepal, an estimated 5 million are abroad and cannot cast their ballots. Many others within Nepal must travel to their home districts, and might decide not to because of the cost. Flights into Kathmandu these days are full of global Nepalis returning just to vote, but almost as many are leaving for overseas jobs. Most of those coming or going are in the 20-40 age group, and a majority want Nepal to see a change in leadership. Bangladesh held an election this month in which citizens overseas could vote by mail. “Bangladesh made maximum use of technology not just for campaigning but also for polling itself. We could have also managed this, so people within Nepal did not have to travel to their home districts to vote,” says Mohna Ansari, former head of Nepal’s National Human Rights Commission who was an election observer in Bangladesh. A 3-day holiday has been declared so people can travel to their home constituencies to cast ballots. Even if there was not enough time to manage ballots for overseas Nepalis, it could have been done for Nepalis within Nepal. Former Chief Election Commissioner Bhojraj Pokharel reckons that physical voting in countries with a large Nepali diaspora would have been a logistical nightmare, but in the PR system, using electronic voting machines or paper ballot could have been piloted in some places. It is not possible to manage the entire voting process until we introduce the internet voting system. “First of all, there needs to be political will to bring the policy and be ready to undertake that level of investment and it is not a one-time cost,” Pokharel says. “A government formed by the GenZ could have atr least issed an ordinance ensuring this right, piloted out-of-country voting where possible, which could have built pressure for the future Parliament and the government. It would have given people hope. It is a lost opportunity.” All major political parties called for voting rights for global Nepalis in their manifestos, but these very leaders blocked legislation allowing it despite a 2017 Supreme Court ruling out of fear that it would be anti-incumbent. Why so late? Bangladesh delivered election results in just one day, but the final results of Nepal's last local polls in 2022 including that of Kathmandu constituencies took nearly a month. Acting Chief Election Commissioner Ram Prasad Bhandari said this week that the results of the First-Past-The-Post (FPTP) ballot counting would “likely” be published within 24 hours of the poll closing at 5PM on 5 March. But many are skeptical. “I wonder if we lack the capacity or know-how to announce results as quickly as possible,” says Mohna Ansari. Former Chief Election Commissioner Pokharel says manual ballot paper counting in Nepal is inherently slow because of the large numner of political parties and/or candidates on the ballot, the counting mechanism, the political behaviour of the candidates/parties and some managerial issues during counting. “Our present policy is to count all the ballot papers at the returning officers' officies, located at the district headquarters. It requires collecting ballot boxes safetly first. This takes time, and there have been cases of ballot boxes being damaged or stolen during transport. In a few highly difficult, geographically remote polling centres, we use a helicopter or transport. But sometimes, accommodating the party and candidates' representatives remains challenging,” explains Pokharel. A solution could be counting ballots at the very booths where they are cast. Another reason for the delay is simply the number of political parties, and the need for each ballot paper to be examined by booth representatives for consensus. In close races, the smallest difference can lead to tense situations, further delaying results, even though counting centres are protected by metal fencing so there is no disruption. After this, then it is the turn of Proportional Representation (PR) ballots to be counted. Weeks pass by the time the results of candidates and parties are tallied and verified. But the most common delay is because election officers think ballot counting is a nine-to-five job. “The efficiency of poll station officers is most important, and they are incentivised for this,” says Ansari, adding that counting can even start within an hour after voting closes. In remote areas, local resources could be mobilised to make counting quicker, but there is a crisis of trust, adds Ansari. That could be easily solved with electronic voting which the EC implemented in the 2008 polls but discontinued because political parties felt the machines could be hacked or manipulated. Sonia Awale writer Sonia Awale is the Editor of Nepali Times where she also serves as the health, science and environment cor",7.2,2026-03-05T14:54:57.220042
1,gorkha,गोरखा,Kedar Mani Khanal,केदार मणी खनाल,Ratopati,एमाले उम्मेदवार नेम्वाङले गरे मतदान,https://www.ratopati.com/story/548133/uml-candidate-nembang-casts-his-vote,,"एमाले उम्मेदवार नेम्वाङले गरे मतदान रातोपाटी संवाददाता बिहीबार, २१ फागुन २०८२, १० : ४४ रातोपाटी संवाददाता बिहीबार, २१ फागुन २०८२ काठमाडौँ । इलाम–२ बाट प्रतिनिधिसभा सदस्य पदको उम्मेदवार सुहाङ नेम्वाङले मतदान गरेका छन् । उनले मरब क्याम्पस इलाम मतदान केन्द्रबाट मतदान गरेका हुन् । एमाले उम्मेदवार नेम्वाङले गरे मतदान खबर पढेर तपाईलाई कस्तो महसुस भयो ? प्रतिक्रिया लेखकको बारेमा रातोपाटी संवाददाता ‘सबैको, सबैभन्दा राम्रो’ रातोपाटी डटकम। लेखकबाट थप भर्खरै तनहुँमा किरियापुत्रीद्वारा मतदान नुवाकोटमा दुई ठाउँबाट मतगणना हुने तस्बिरमा हेर्नुहोस् भक्तपुर बहुमुखी क्याम्पसको मतदान चितवनमा अहिलेसम्म ४५ प्रतिशत मतदान पहिलो पटक मत दिनेहरू भन्छन्– ‘हाम्रो भोट खेर जाँदैन’ कास्कीमा दिउँसो २ बजेसम्म ४३ प्रतिशत मत खस्यो, महिलाको सहभागिता उच्च ट्रेन्डिङ १. मतदान केन्द्रमा खटिएका कर्मचारी नै पक्राउ परेपछि... २. गन्तव्यमा नपुगी किन फर्कियो बालेन सवार हेलिकप्टर ? ३. बालेन चढेको हेलिकप्टर झापामा ल्यान्ड गरेन, काठमाडौँ फर्कँदै ४. श्रीलंका नजिकै इरानी युद्धपोतमा अमेरिकी आक्रमण, ८० नौसैनिकको मृत्यु ५. बुटवलमा पैसा बाँडेको आरोपमा एमाले र रास्वपाका कार्यकर्ताबिच झडप ६. कर्मचारीमाथि हातपात गर्न खोजेपछि दोलखामा हवाई फायर ७. चुनावमा खटिएका १२ जना सुरक्षाकर्मी र दुई मतदान अधिकृतको मृत्यु ८. राष्ट्रिय सुरक्षा परिषद्को बैठकले के गर्‍याे निर्णय ? छुटाउनुभयो कि ? निर्वाचन बहिष्कार गर्दै आन्दोलनको घोषणा प्रतिनिधि सभा उम्मेदवारले नै पार्टी छाडेपछि... प्रतिनिधि सभा उम्मेदवार पौडेलले फिर्ता लिए उम्मेदवारी रास्वपा र एमालेका कार्यकर्ताबिच झडप, २ जना घाइते धादिङमा बस दुर्घटना: १७ जनाको मृत्यु, २४ घाइते गौर झडप : ३ गाडी र दुई मोटरसाइकलमा आगजनी धादिङ बस दुर्घटनाः मृत्यु भएका १९ मध्ये ९ जनाको सनाखत (नामावलीसहित) बालेनलाई कारबाहीसहित नागरिकता रद्दको माग गर्दै गृह मन्त्रालयमा उजुरी",5.7,2026-03-05T14:54:57.220046
1,gorkha,गोरखा,Kedar Mani Khanal,केदार मणी खनाल,DDG (ne1),गोरखा-१ : प्रदेश ४ - प्रतिनिधिसभाको निर्वाचन २०८२ विवरण तथा नतिजा,https://election.ekantipur.com/pradesh-4/district-gorkha/constituency-1,"गोरखा-१ : गण्डकी प्रदेश - नेपालनिर्वाचन२०८२ को प्रतिनिधिसभानिर्वाचनसम्बन्धी ताजा नतिजा,उम्मेदवारविवरण, मतगणना अपडेट र ...","गोरखा-१ : गण्डकी प्रदेश - नेपालनिर्वाचन२०८२ को प्रतिनिधिसभानिर्वाचनसम्बन्धी ताजा नतिजा,उम्मेदवारविवरण, मतगणना अपडेट र ...",5.4,2026-03-05T14:54:57.220048
1,gorkha,गोरखा,Kedar Mani Khanal,केदार मणी खनाल,Reddit/r/NepalSocial,[r/NepalSocial] Is directly elected PM in Nepal a good idea?,https://www.reddit.com/r/NepalSocial/comments/1nt3brc/is_directly_elected_pm_in_nepal_a_good_idea/,↑0  💬69,"I'm not well versed in politics so this is more of post to gather ideas and opinions from different perspectives and people who are well educated in politics. 

But as far as I understand, directly elected PM might not be good for Nepal. Let's look at the current example of USA. They have directly elected president (equivalent of PM) and look who's in power now and how he's been destroying every shred of democracy and banking towards fascism. But for the sake of argument, I will point to flaw of my own argument. I have chosen the worst example of directly elected President (PM incase of Nepal) whereas in past America had done very well because of the same system. 

But the current situation of USA can be a learning opportunity or cautionary tale for us as well. Whoever can manipulate the mass wins the election not the most competent one, not the one with the best interest of the common people. Most people who voted for Trump themselves are suffering because of Trump right now because they were manipulated to believe Trump was on their side, while he's on his own side and billionaire's side.

In the age of information, it's even easier to manipulate the people in massive levels. Right now, I see so many posts in social media harshly denouncing Balen, Sudan Gurung (Hami Nepal), RSP and not just the corrupted old guards. In most ways, it's a good thing because any person in power or political party should be criticized for their actions despite their reputation. Questioning everything and everyone should be default. 

But at the same time, I also see absolute lack of nuances. Almost every post is highly polarized. Aren't we caple of having nuanced opinions? Should we always have to fit ourselves in a given box? I either see support without criticism or harsh criticism without giving credit where credit is due. It's either ""You still support this dude? Look at this news"" or ""You guys demonize this guy too much, look at the reality s/he's not really a bad guy""

I know there's a substantial chance of corrupted old guard returning to power with the older parliament system of choosing PM. But at the same time, with directly elected PM, there's a risk of foreign body infiltrating our government and inserting a puppet PM. There's also risk of anyone with lots of backing by oligarchs getting elected as the PM. Or just anyone who's charismatic at surface level but highly incompetent to run a nation being elected.

Basically whoever can successfully run a massive propaganda and manipulation through social media can be PM, which is very problematic.

So what is the better alternative? Is there a middle ground between directly elected PM and PM appointed by parliament? 

People with better political wisdom and knowledge and people with different perspectives, what do you guys think?

Please just don't comment just couple of phrases or a sentence just indicating doom and gloom or just anger or disagreement. Please provide some wisdom and knowledge or at least some explanations towards your opinion.

Thanks for making a submission. Please use an appropriate flair for better reach and response. In case of a NSFW post, use ""sax sux"" flair and tag it as NSFW. Otherwise, the post will be removed.

*I am a bot, and this action was performed automatically. Please [contact the moderators of this subreddit](/message/compose/?to=/r/NepalSocial) if you have any questions or concerns.*
---
No it is not. For detailed answer go into my profile and read some of my comments.
Example: https://www.reddit.com/r/Nepal/comments/1nrvx4w/comment/nghxj0k/?context=3&amp;utm_source=share&amp;utm_medium=mweb3x&amp;utm_name=mweb3xcss&amp;utm_term=1&amp;utm_content=share_button

And its replies
---
Nope not a good idea (for now at least). People are only pushing this idea because they heard someone do the same. 

It's blind leading the blind
---
for a country that does not have good institutions or atleast the judiciary. Directly elected executive system is actually pretty bad. Just look at the former soviet republics who had directly elected executives. Well newrly 100% fell into authoritarian regimes. 

I feel like the same might happen here in Nepal too with populism being very common. Maybe, having an electoral system with run off voting might minimize its effect but it is too expensive for country like Nepal
---
I also align with your line of thinking. I also don't think directly elected PM (PM elected by popular vote) isn't a good idea but TBH I don't either know what a better alternative could be. 

The best we can do is to encourage people with good wisdom, knowledge and track records to run for parliament; representatives you know from the local level and can trust. 

Also, maybe a hybrid system could be introduced by amending the constitution. So that by itself is very complicated. But hypothetically a system where parliament chooses few candidates to run for the office and then people vote on it. Similar to how it works in the USA. But we h",5.4,2026-03-05T14:54:57.220050
