Constituency,DistrictEnglish,DistrictNepali,CandidateEnglish,CandidateNepali,Source,Title,URL,Snippet,Content,RelevanceScore,ScrapedAt
1,gorkha,गोरखा,Kedar Mani Khanal,केदार मणी खनाल,Ratopati,कांग्रेस नेता डा.कोइरालाद्वारा मतदान,https://www.ratopati.com/story/548169/congress-leader-dr-koirala-casts-his-vote,,"कांग्रेस नेता डा.कोइरालाद्वारा मतदान रासस बिहीबार, २१ फागुन २०८२, १२ : ११ फाइल तस्बिर रासस बिहीबार, २१ फागुन २०८२ मोरङ ।  नेपाली कांग्रेसका डा.शेखर कोइरालाले विराटनगर महानगरपालिका–७ स्थित आदर्श माविमा रहेको मतदान केन्द्रबाट मतदान गरेका छन् । मोरङ क्षेत्र नं ६ का उम्मेदवारसमेत रहनुभएका डा शेखर कोइरालाले मतदानपछि पत्रकारसँग संक्षिप्त कुराकानी गर्दै सबैको आपसी सहकार्य र समन्वयबाट मुलुक निर्माणमा लाग्नुपर्ने धारणा राखे । डा.शेखर कोइराला खबर पढेर तपाईलाई कस्तो महसुस भयो ? प्रतिक्रिया लेखकको बारेमा रासस राष्ट्रिय समाचार समिति नेपालकाे  सरकारी समाचार संस्था हाे । लेखकबाट थप भर्खरै तनहुँमा किरियापुत्रीद्वारा मतदान नुवाकोटमा दुई ठाउँबाट मतगणना हुने तस्बिरमा हेर्नुहोस् भक्तपुर बहुमुखी क्याम्पसको मतदान चितवनमा अहिलेसम्म ४५ प्रतिशत मतदान पहिलो पटक मत दिनेहरू भन्छन्– ‘हाम्रो भोट खेर जाँदैन’ कास्कीमा दिउँसो २ बजेसम्म ४३ प्रतिशत मत खस्यो, महिलाको सहभागिता उच्च ट्रेन्डिङ १. मतदान केन्द्रमा खटिएका कर्मचारी नै पक्राउ परेपछि... २. गन्तव्यमा नपुगी किन फर्कियो बालेन सवार हेलिकप्टर ? ३. बालेन चढेको हेलिकप्टर झापामा ल्यान्ड गरेन, काठमाडौँ फर्कँदै ४. श्रीलंका नजिकै इरानी युद्धपोतमा अमेरिकी आक्रमण, ८० नौसैनिकको मृत्यु ५. बुटवलमा पैसा बाँडेको आरोपमा एमाले र रास्वपाका कार्यकर्ताबिच झडप ६. कर्मचारीमाथि हातपात गर्न खोजेपछि दोलखामा हवाई फायर ७. चुनावमा खटिएका १२ जना सुरक्षाकर्मी र दुई मतदान अधिकृतको मृत्यु ८. राष्ट्रिय सुरक्षा परिषद्को बैठकले के गर्‍याे निर्णय ? छुटाउनुभयो कि ? निर्वाचन बहिष्कार गर्दै आन्दोलनको घोषणा प्रतिनिधि सभा उम्मेदवारले नै पार्टी छाडेपछि... प्रतिनिधि सभा उम्मेदवार पौडेलले फिर्ता लिए उम्मेदवारी रास्वपा र एमालेका कार्यकर्ताबिच झडप, २ जना घाइते धादिङमा बस दुर्घटना: १७ जनाको मृत्यु, २४ घाइते गौर झडप : ३ गाडी र दुई मोटरसाइकलमा आगजनी धादिङ बस दुर्घटनाः मृत्यु भएका १९ मध्ये ९ जनाको सनाखत (नामावलीसहित) बालेनलाई कारबाहीसहित नागरिकता रद्दको माग गर्दै गृह मन्त्रालयमा उजुरी",5.1,2026-03-05T14:54:57.220053
1,gorkha,गोरखा,Kedar Mani Khanal,केदार मणी खनाल,Reddit/r/Nepal,[r/Nepal] How many of you are planning to vote for Nepali Congress this election?,https://www.reddit.com/r/Nepal/comments/1qixy4b/how_many_of_you_are_planning_to_vote_for_nepali/,↑0  💬11,"Genuine question to fellow voters here.

Nepali Congress appears to be undergoing a meaningful transition this election cycle. The party has not given tickets to many old leaders, and out of 165 candidates, 102 are contesting their first-ever election — a clear generational shift compared to past elections.

There’s also a visible change in leadership direction. The party’s public face is increasingly Gagan Thapa (50) rather than Sher Bahadur Deuba (80), marking a move toward younger leadership while still operating within democratic party structures.

Beyond personalities, what stands out is the core vision of Nepali Congress:

It remains Nepal’s only fully democratic mass party in both ideology and practice, with leadership change happening through internal elections rather than force or cult politics.

Ideologically, Nepali Congress supports liberal democracy, constitutionalism, and individual freedoms, placing civil liberties at the center of governance.

Economically, the party has historically stood for liberalization, private-sector–led growth, and regulated capitalism, rather than state-dominated or ideologically rigid economic models.

Its vision emphasizes market economy with social justice — encouraging entrepreneurship, investment, and innovation while maintaining a social safety net.

So I’m curious:

Does this combination of generational change + democratic values + economic liberalism make you more inclined to vote for Nepali Congress?

Or do you see this as cosmetic reform rather than structural change?

What would actually convince you that Nepali Congress has evolved?

Looking forward to honest takes — whether supportive, skeptical, or critical.

Not this time
---
Timi haru tyo headline matra he xau ki? Pr team ko hai bhane ta kei xaina tara. Have you seen your fellows who supports different people in your party and is trying to manipulate vote. GT dai ko team ho vane look to people of your previous president they are not happy and are constantly poking. Khai Kun bubble ma basiraxau.
---
Not this time and my parents are Nepali Congress voters but this time I'm urging them to vote for Ghanti for change. 

Gagan Thapa is far better than Deuba and Oli and many other mainstream politicians but he has been part of this same corrupt system for a long time but I have serious doubts that he will bring fundamental changes that this Country needs as he will have powerful interest groups within his party against him.. that's why he was forced to give ticket to someone like Bijay Gacchadar. Who knows how many more compromises he has to made later if he becomes PM like he says he wants to appoint people based on merit but I doubt that's gonna happen. 

Look at RSP, they are new, they don't have any political unions like in bureaucracy and student unions, so there's a chance they can bring fundamental changes.
---
Nepali Congress for most part of post 2063 let go of their ideologies that actually were the pillars of the party. After 2048, economically Nepal did remarkably good but slowed down with maoist terrorism, and never took off after that. Nepali Congress's main mistake was colluding with commies which should be unforgivable. 

Moving forward, I want to see Nepali Congress stand firm in what they believed, specially with their stance in economy. Private sector should feel assurance with existence of Nepali Congress. I have high hopes moving forward and restructuring party isn't a job of one day. No matter the election result, Nepali Congress should start renovating the party from grassroots, educating people with Nepali Congress's ideologies and making clear what Nepali Congress actually stands for.
---
&gt; Genuine question to fellow voters here.

Points to you to admit up front that you are from Gagan's cyber army. I encourage you to go one step further and also disclose how much you are being paid by Gagan's team.

Posts like these show just how much corruption Gagan has done, that he has so much money to spend on his cyber army.

&gt; Beyond personalities, what stands out is the core vision of Nepali Congress:

Nepali Congress and vision. Surely this is a joke? Their vision is personal benefits for the party members.

&gt; It remains Nepal’s only fully democratic mass party in both ideology and practice, with leadership change happening through internal elections rather than force or cult politics.

Ah yes, how democratic that the internal election was rushed and there were no other candidates. Even Oli has had to fight in elections in UML. Do you seriously think that no one else wanted to be party president and they all supported Gagan as this president?

&gt; Ideologically, Nepali Congress supports liberal democracy, constitutionalism, and individual freedoms, placing civil liberties at the center of governance.

Again, this is just pure fantasy, and not at all what Nepali Congress has supported. Nepal's press freedom and civil liberties has been going downhill. It has also been noticed by i",4.8,2026-03-05T14:54:57.220054
1,gorkha,गोरखा,Kedar Mani Khanal,केदार मणी खनाल,Ratopati,"उदयपुरमा मोटरसाइकल रुखमा ठोक्किँदा एकको मृत्यु, दुई जना गम्भीर घाइते",https://www.ratopati.com/story/548190/one-dead-two-seriously-injured-after-motorcycle-crashes-into-tree-in-udayapur,,"उदयपुरमा मोटरसाइकल रुखमा ठोक्किँदा एकको मृत्यु, दुई जना गम्भीर घाइते रातोपाटी संवाददाता बिहीबार, २१ फागुन २०८२, १२ : ५१ रातोपाटी संवाददाता बिहीबार, २१ फागुन २०८२ सारांश उदयपुरको चौदण्डीगढीमा मोटरसाइकल दुर्घटना हुँदा एक जनाको मृत्यु भएको छ। दुर्घटनामा दुई जना गम्भीर घाइते भएका छन् र उनीहरूको विराटनगरमा उपचार भइरहेको छ। प्रहरीले घटनाको अनुसन्धान गरिरहेको छ, तीव्र गति र तीन जना सवार हुनु दुर्घटनाको कारण हुनसक्ने अनुमान छ। उदयपुर । उदयपुरको चौदण्डीगढी नगरपालिकामा आज बिहान मोटरसाइकल दुर्घटना हुँदा एक जनाको मृत्यु भएको छ भने दुई जना गम्भीर घाइते भएका छन् । मदन भण्डारी लोकमार्ग अन्तर्गत चौदण्डीगढी नगरपालिका वडा नं। १० भिमा खण्डमा गाईघाटबाट बेल्टारतर्फ जाँदै गरेको प्र.०१-०५-००२ प १८२७ नम्बरको मोटरसाइकल अनियन्त्रित भई दुर्घटना भएको हो । तीव्र गतिमा रहेको मोटरसाइकल सडकको उत्तरतर्फ रहेको सखुवाको रुखमा ठोक्किँदा मोटरसाइकल चालक चौदण्डीगढी नगरपालिका–५ सिवाई बस्ने १८ वर्षीय समिर चौधरीको मृत्यु भएको प्रहरीले जनाएको छ । दुर्घटनामा गम्भीर घाइते भएका चौधरीलाई तत्काल उद्धार गरी नगर अस्पताल बेल्टार लगिएकोमा अस्पताल पुर्‍याउनासाथ चिकित्सकले मृत घोषणा गरेका थिए । सोही दुर्घटनामा परी मोटरसाइकलमा सवार अन्य दुई जना गम्भीर घाइते भएका छन् । घाइते हुनेहरूमा चौदण्डीगढी–५ सिवाई बस्ने १८ वर्षीय मौसम चौधरी र सोही ठाउँका २३ वर्षीय अशोक चौधरी रहेका छन् । घाइते दुवै जनालाई नगर अस्पतालमा सामान्य उपचारपछि थप उपचारका लागि विराटनगरस्थित सुविधा सम्पन्न अस्पतालमा रेफर गरिएको छ । बिहान करिब ११:०० बजे भएको उक्त दुर्घटनाको विषयमा इलाका प्रहरी कार्यालय बेल्टारबाट खटिएको प्रहरी टोलीले थप अनुसन्धान गरिरहेको जनाएको छ । एउटै मोटरसाइकलमा तीन जना सवार रहेकाले अनियन्त्रित भई दुर्घटना भएको हुनसक्ने प्रारम्भिक अनुमान गरिएको छ । घाइते मोटरसाइकल दुर्घटना उदयपुर दुर्घटना खबर पढेर तपाईलाई कस्तो महसुस भयो ? प्रतिक्रिया लेखकको बारेमा रातोपाटी संवाददाता ‘सबैको, सबैभन्दा राम्रो’ रातोपाटी डटकम। लेखकबाट थप भर्खरै तनहुँमा किरियापुत्रीद्वारा मतदान नुवाकोटमा दुई ठाउँबाट मतगणना हुने तस्बिरमा हेर्नुहोस् भक्तपुर बहुमुखी क्याम्पसको मतदान चितवनमा अहिलेसम्म ४५ प्रतिशत मतदान पहिलो पटक मत दिनेहरू भन्छन्– ‘हाम्रो भोट खेर जाँदैन’ कास्कीमा दिउँसो २ बजेसम्म ४३ प्रतिशत मत खस्यो, महिलाको सहभागिता उच्च ट्रेन्डिङ १. मतदान केन्द्रमा खटिएका कर्मचारी नै पक्राउ परेपछि... २. गन्तव्यमा नपुगी किन फर्कियो बालेन सवार हेलिकप्टर ? ३. बालेन चढेको हेलिकप्टर झापामा ल्यान्ड गरेन, काठमाडौँ फर्कँदै ४. श्रीलंका नजिकै इरानी युद्धपोतमा अमेरिकी आक्रमण, ८० नौसैनिकको मृत्यु ५. बुटवलमा पैसा बाँडेको आरोपमा एमाले र रास्वपाका कार्यकर्ताबिच झडप ६. कर्मचारीमाथि हातपात गर्न खोजेपछि दोलखामा हवाई फायर ७. चुनावमा खटिएका १२ जना सुरक्षाकर्मी र दुई मतदान अधिकृतको मृत्यु ८. राष्ट्रिय सुरक्षा परिषद्को बैठकले के गर्‍याे निर्णय ? छुटाउनुभयो कि ? निर्वाचन बहिष्कार गर्दै आन्दोलनको घोषणा प्रतिनिधि सभा उम्मेदवारले नै पार्टी छाडेपछि... प्रतिनिधि सभा उम्मेदवार पौडेलले फिर्ता लिए उम्मेदवारी रास्वपा र एमालेका कार्यकर्ताबिच झडप, २ जना घाइते धादिङमा बस दुर्घटना: १७ जनाको मृत्यु, २४ घाइते गौर झडप : ३ गाडी र दुई मोटरसाइकलमा आगजनी धादिङ बस दुर्घटनाः मृत्यु भएका १९ मध्ये ९ जनाको सनाखत (नामावलीसहित) बालेनलाई कारबाहीसहित नागरिकता रद्दको माग गर्दै गृह मन्त्रालयमा उजुरी",4.5,2026-03-05T14:54:57.220057
