Constituency,DistrictEnglish,DistrictNepali,CandidateEnglish,CandidateNepali,Source,Title,URL,Snippet,Content,RelevanceScore,ScrapedAt
1,gorkha,गोरखा,Kedar Mani Khanal,केदार मणी खनाल,OnlineKhabar EN,"From the Kathmandu Press: Wednesday, July 4, 2018",https://english.onlinekhabar.com/from-the-kathmandu-press-wednesday-july-4-2018.html,,"From the Kathmandu Press: Wednesday, July 4, 2018 Onlinekhabar Wednesday, July 4, 2018 0 Comments Major Nepali and English broadsheet dailies published from Kathmandu on Wednesday have accorded top priority to a host of issues from multiple sectors. The 15 th fast-unto-death of medical education reform activist Dr Govinda KC has been a key concern for the newspapers as his health condition has reportedly deteriorated on the fourth day on Tuesday. Likewise, there are concerns about the fast-unto-death of Ganga Maya Adhikari too. The incessant rainfall for around three days in many parts of the country wreaked havoc in various districts and newspapers have featured stories about floods and landslides on the front pages. There are few stories about other political, economic and sociocultural issues. ­Important Difficulties in Dr KC’s treatment in Jumla Dr Govinda KC in Jumla Nagarik , Naya Patrika and Republica report that the local administration in Jumla district tried to create an obstruction in the treatment of veteran medical education reform activist Dr Govinda KC as his health condition is deteriorating. Consequently, a medical team sent by the Karnali Academy of Health Sciences has returned emptyhanded, the Nagarik report informs. On the other hand, doctors and health professionals at Karnali also launched a strike demanding that the government address his demands, according to Naya Patrika . Meanwhile, Minister for Education Giriraj Mani Pokharel has insisted that the new Medical Education Bill that the government has registered at the Parliament Secretariat is in line with the report submitted by a panel led by educationist Kedar Bhakta Mathema, reports Annapurna Post . His comment responds to accusations by some stakeholders that Minister Pokharel is trying to change the law with mala fide intentions. After court, Parliament rejects UN support File: Nepal’s Parliament building Kantipur and The Himalayan Times report on their front pages that the Federal Parliament Secretariat has decided not to accept any grant from foreign donors for its regular activities. The decision follows a severe criticism it received from the press and the public as well as some lawmakers for conducting a training programme for lawmakers with the financial support of a UN agency. House of Representatives Speaker Krishna Bahadur Mahara says it is the government’s responsibility to manage budget for parliamentary activities therefore the Secretariat does not sign any agreement with donors for funds. Earlier, the Supreme Court had also made a similar decision. The Himalayan Times lead story claims that the Secretariat made the recent decision though an implementation agreement for the Parliamentary Support Project was already signed with the United Nations Development Programme to receive a grant of USD 5.9 million (approximately Rs 650 million). Stranded Indian pilgrims begin to move The Indian government informed on Tuesday morning that over 1,000 Indian pilgrims heading to Manasarovar of Tibet via Nepal got stuck halfway in Humla of Nepal as flights could be operated due to the bad weather. However, some of them have been rescued to safety, according to reports in The Himalayan Times , Republica and The Kathmandu Post . Quoting Indian Embassy sources in Kathmandu, The Himalayan Times reports that 150 pilgrims have been brought to Nepalgunj whereas around 150 were brought to Humla district headquarters Simikot from Hilsa on helicopters. Meanwhile, two Indian nationals died and their bodies have been airlifted to Kathmandu via Nepalgunj from Simikot on special helicopters yesterday, adds Republica . Ignored Narayangadh-Muglin road upgraded without geological study The lead story in Kantipur claims that the government did not conduct necessary geological study before upgrading the Narayangadh-Muglin road in Chitwan district. The project has been just complete after a wait of three years. The report quotes some geologists to claims that frequent landslides the highway regularly faces in the monsoon season is a just of lack of a proper geological study. Further, the project did not mombilise geologists and engineers for the monitoring of upgrading works, according to the report. Nepal Police objects to Province 2 Police Bill Nepal Police IG Sarbendra Khanal The Nepal Police headquarters says a bill tabled at the Province 2 Assembly to establish the provincial police force is against the constitution, according to Nagarik . The national police organisation argues that the provincial police force is not necessary as Nepal Police is adopting a federal setup. Inspector General Sarbendra Khanal recently held a meeting with Home Minister Ram Bahadur Thapa and Home Secretary Prem Kumar Rai and expressed his concerns over the content of the bill, according to the report. Interesting Govt to hand over Budhigandaki project to China again File image: Minister for Energy Janardan Sharma (l) exchanges an agreement with the representative of ",3.0,2026-03-05T14:54:57.220074
1,gorkha,गोरखा,Kedar Mani Khanal,केदार मणी खनाल,Nepali Times,Who is accountable for teacher-student relationships?,https://www.nepalitimes.com/here-now/who-is-accountable-for-teacher-student-relationships,,"Who is accountable for teacher-student relationships? “I was groomed, then I was sued for defamation,” says university alumna about a faculty member 26 February 2026 Subeksha Poudel 0 As a new student at Kathmandu University's Bachelor’s in Fine Arts in 2014, Mukta, 25 then, thought she must be doing something good when her teacher singled her out for attention. Her teacher was Sujan Chitrakar, then 40, the senior-most faculty, and a celebrated artist. Chitrakar has taught many contemporary Nepali artists and played an important role in establishing what is now KU’s Department of Art and Design (pictured). In between messages to Mukta about schoolwork, he texted to say he missed her or that she looked beautiful. She recalls being taken aback by a particular text that said: ‘I’m going for a bath. Do you want to see me?’ This was immediately followed with a cartoonish drawing with ‘Nude’ written next to it. Mukta awkwardly replied with a laugh, unsure how else to respond to such a message from her teacher, whom everyone placed on a pedestal. During Mukta’s first year in school, she says Chitrakar continued to shower her with gifts, asked her out for coffee, and insisted on driving her around. Once, when she was on his motorcycle returning home from university, Mukta remembers Chitrakar asking her to kiss him on his shoulder. When she refused, he apologised profusely, then asked if she was trying to seduce him. Seeing how shocked Mukta was, the teacher grabbed her hand and rubbed it against his chest, saying it was just a joke. A few weeks later, Chitrakar told Mukta that he couldn’t live without her and that they should be in a relationship. Having only looked up to him as a teacher, Mukta was uncertain about her feelings. When the earthquake struck in 2015, Chitrakar came to check on Mukta, and with her guards down, she felt perhaps his love was genuine. She didn’t doubt if she was safe with him. A decade later, still reeling from psychological trauma and career setbacks because of the relationship, Mukta is breaking her silence, accusing Chitrakar of abusing his power and grooming her. He had the duty of teaching and evaluating her, instead, Mukta says he used her for sex and emotional support from 2015 to 2019, while she was a student at KU. DEFAMATION SUIT She has been urging KU and art institutions to safeguard its students against sexual misconduct, but Chitrakar slammed a defamation lawsuit against her in January 2025 stating she damaged his reputation over what he described in court filings as a ""consensual relationship”. Earlier this week, the Kathmandu District court ruled that Chitrakar’s defamation claim could not be proven. We asked Chitrakar after the verdict about his conduct. His reply: “I’m sorry for the students who felt uncomfortable, but I did my duty well and good. It is ungrateful of the students to say that. Not everyone has to like me.” In answer to a query about his stance on intimate relationship between staff and student, he said: “For me it is a big no to date a student. Consequences arise and I am facing them now. Many staff-student intimate relations, including in my department, have ended in happy marriages. It’s a choice based on their personal and social ethics, and something to be determined by university policy.” Chitrakar said he now draws personal and professional boundaries with students, and says his relationship was not planned. He added, “Regardless of being a teacher I should not have dated a student because I'm a married man. If I was unmarried it would have been ok. While there is no definitive data on sexual misconduct in Nepal, interviews with more than 23 faculty and students from KU and TU for this story reveal that intimate staff-student relations are normalised, and in some cases even encouraged. Studies also suggest that sexual harassment is rampant in higher education in Nepal. The lack of university policies, power imbalance between staff and students, fear of retaliation, breaches of confidentiality, and the protection of perpetrators all contribute to impunity for sexual misconduct. Indeed, after students alleged sexual harassment, bullying, and homophobia against Yubaraj Sangroula of Kathmandu School of Law, and other faculty members in March 2025, the university filed slander lawsuits targeting a student whistleblower and alumni. Sangroula is contesting as an independent candidate in next week’s election from Jhapa-2. Seven years after complaints surfaced against retired lecturer Krishna Bhattachan for sexually harassing women students , Tribhuvan University, the government run institution, is still drafting its own policy and complaint procedure. And noted sculptor and former KU faculty member Gopal Kalapremi is yet to appear at Kathmandu District Court, after he was issued a summon on sexual harassment charges in 2024. Nepal’s Sexual Harassment at Workplace (Prevention) Act (2014) and the National Criminal (Code) Act, 2017 both forbid sexual relations",3.0,2026-03-05T14:54:57.220076
1,gorkha,गोरखा,Kedar Mani Khanal,केदार मणी खनाल,Nepali Times,West Asia war and Nepalis,https://www.nepalitimes.com/news/west-asia-war-and-nepalis,,"West Asia war and Nepalis Two million Nepalis live and work in the Gulf region that is the mainstay of country’s economy through remittances 28 February 2026 Nepali Times 0 Passengers at Kathmandu airport waiting for flights on Saturday evening. On Saturday, Iran retaliated with missile strikes on Abu Dhabi, Dubai, Bahrain and Qatar, a region where there are an estimated 2 million Nepalis working to send money home. In addition, thousands of Nepalis were preparing to board flights to Kathmandu from West Asian cities this weekend to vote in the 5 March election. Many are said to be stranded at various aviation hubs. A Qatar Airways flight from Doha took off just before the air space was closed, while Air Arabia and Kuwait Airways have diverted or cancelled flights. Nepalis in the West Asian region said things were relatively calm where they were, although some heard loud explosions at about noon local time. In Dubai, some thought they were Ramadan fireworks. In Kuwait, nearly 2,000 Nepalis working in the US military base as security guards and cleaners were evacuated before the strikes. In Bahrain where the US Fifth Fleet naval base is located and which was hit by two Iranian missiles, workers contacted by Nepali Times said the situation was under control and the authorities had told everyone to stay indoors and not use highways. The conflict also coincided with the beginning of Nepal’s trekking and mountaineering season, and tourists were either on their way or planning to leave European and North American cities for Himalayan hikes. Most of them transit through Doha, Dubai or Kuwait and all three airports are closed. Turkish Airlines flights via Istanbul are still operating. Qatar and UAE airspace closed. Credit: Flightradar24 However, the main impact for the world could be a spike in the price of petroleum products if the strategic Strait of Hormuz is blocked. China relies on Iranian oil for their refineries, and Nepal could be affected indirectly if the economies of its neighbours are hit. Nepal imports all its diesel, petrol, LPG and aviation fuel from India which sources it mainly from the Gulf, and until recently from Russia. Petroleum makes up 25% of the value of all imports, and that is more than Nepal earns from all its exports. Saudi Arabia this year overtook the UAE as the main destination for Nepali workers, with the number now totalling 400,000. There are said to be as many in the UAE, and another 350,000 in Qatar. There are another 100,000 mostly women in Kuwait, and 50,000 each in Oman and Bahrain. Iran retaliated with missile strikes on Abu Dhabi, Dubai, Bahrain and Qatar on Saturday. Nepal receives nearly $11 billion a year in remittances from overseas Nepalis (not counting India) through official channels, although the total is said to be much more.  This makes up more than a quarter of Nepal’s GDP equivalent — one of the highest proportions in the world. More than half of the overseas remittances to Nepal comes from its workers in the Gulf, and it is the mainstay of the country’s economy. Nepalis in Saudi Arabia, Qatar and the UAE alone send home more than $3 billion a year, much of that helping support their families back home. An average Nepali worker in the Gulf sends home nearly $2,500 a year, and this is spent mainly for household supplies, children’s education and healthcare. There are also an estimated 7,000 Nepali caregivers and healthcare workers in Israel, and most of them are women. The Nepal Embassy has asked Nepalis in Israel to take caution and move to bomb shelters. Tags overseas Nepalis West Asia conflict Gulf countries",2.7,2026-03-05T14:54:57.220078
1,gorkha,गोरखा,Kedar Mani Khanal,केदार मणी खनाल,DDG (ne1),"केदारमणि खनाल, गोरखा - १, राष्ट्रिय प्रजातन्त्र पार्टी, Nepal Election 2082",https://election.onlinekhabar.com/central-candidate/kedar-mani-khanal,"उम्मेदवारप्रोफाइल दोस्रो पटक जित निकाल्ने दाउ शिशिरखनालराष्ट्रिय स्वतन्त्र पार्टी, काठमाडौं - ६ सडकको बहसबाट संसद्‌ पुग्ने ...","उम्मेदवारप्रोफाइल दोस्रो पटक जित निकाल्ने दाउ शिशिरखनालराष्ट्रिय स्वतन्त्र पार्टी, काठमाडौं - ६ सडकको बहसबाट संसद्‌ पुग्ने ...",2.4,2026-03-05T14:54:57.220080
1,gorkha,गोरखा,Kedar Mani Khanal,केदार मणी खनाल,DDG (ne1),गोरखा निर्वाचन क्षेत्र नं. १ मा केदार मणि खनाल उम्मेदवार,https://www.youtube.com/watch?v=keT8tQ9vRI0,गोरखानिर्वाचनक्षेत्र नं. १ माकेदारमणिखनालउम्मेदवारGohira TV 32.4K subscribers Subscribe,गोरखानिर्वाचनक्षेत्र नं. १ माकेदारमणिखनालउम्मेदवारGohira TV 32.4K subscribers Subscribe,2.4,2026-03-05T14:54:57.220082
1,gorkha,गोरखा,Kedar Mani Khanal,केदार मणी खनाल,Reddit/r/Nepal,[r/Nepal] My Thoughts: Directly Elected PM Is Not a good option for Nepal,https://www.reddit.com/r/Nepal/comments/1nt9bc9/my_thoughts_directly_elected_pm_is_not_a_good/,↑83  💬55,"I don’t think directly elected Prime Minister is the right option for Nepal. The reality is, Nepali people are so easily influenced—like sheep. Just look at how many blindly believe whatever Durga Prasai says. If a system of directly elected PM existed, someone like him could manipulate the masses and climb to power, no matter how dangerous or unfit he might be. And if not him, then what about other bad person who could exploit the same system?

Instead of copying Western or Indian political models, Nepal should create its own unique system—something that actually works for the mindset and context of our society. Honestly, what I see right now makes me feel like Nepal doesn’t need more “democracy,” it needs a strong leader, maybe even a dictator, to straighten things out. Because at this point, people are not supporting capable leaders like Balen; instead, they’re busy spreading hate and propaganda against him. And the sad part? The public is actually believing it—without any research, without any critical thinking.

It’s the same attitude everywhere. People complain about modern initiatives like *Shark Tank Nepal* just because the show uses English. But it’s literally a business show, and business everywhere uses English. Why is this even a problem? English is an international language—if you can’t accept that, how do you expect to compete in the global economy?

This is why I believe directly elected PM is not suitable for Nepal right now. Until the mindset of the people changes, such a system will only invite corruption, manipulation, and chaos.

This is my thoughts and I am on democratic country and I can share my thoughts. Thank you.

Why have election in the first place then if people are sheep. The elected sheeps  elect the biggest sheep to the heart of the government then.
---
Directly electing a PM in Nepal sounds great on paper, but given how easily people are swayed by personalities and propaganda, it could backfire. A system needs to fit the mindset of the society, not just copy foreign models. Until political awareness and critical thinking improve, directly elected leadership could do more harm than good.
---
we need to have a nice check and balance system, whatever the selection modality is
---
i think the main point of directly elected PM is to make government stable. If the gov didn't do good work, people can change it next time.
---
Party Reform xahi main debate hunu parne. Yo nagare samma Direct elect PM khutta ma bancharo hanne kaam ho.
---
Using 3 quotes from one of my fav book to explain why balen is getting hate

• “Courage is the only virtue you cannot fake. Real leaders display it by putting their own necks on the line.”

• “The most important aspect of leadership is having skin in the game, taking personal risk for your decisions. A leader who risks nothing isn’t a leader but a bureaucrat.”

• “A leader is someone who would rather be harmed than see others harmed because of his decisions.”
---
Directly elected pm is Maoist ideology. Given their support and popularity maoist wish to use in their favour. And create dictatorship. I don’t know why people demand all these things without knowing the positive and negative aspects of these things.",2.4,2026-03-05T14:54:57.220084
1,gorkha,गोरखा,Kedar Mani Khanal,केदार मणी खनाल,DDG (en1),Election Commission Nepal,https://election.gov.np/en/page/candidate-list-hor,"FAQ नेपालीElectionCommissionNepalKantipath, Kathmandu About us Electoral Framework Voter Education Political Party ResourcesElectionsFederalElection2025 National Assembly, 2082 PRElection, 2082","FAQ नेपालीElectionCommissionNepalKantipath, Kathmandu About us Electoral Framework Voter Education Political Party ResourcesElectionsFederalElection2025 National Assembly, 2082 PRElection, 2082",1.8,2026-03-05T14:54:57.220087
1,gorkha,गोरखा,Kedar Mani Khanal,केदार मणी खनाल,OnlineKhabar EN,Nepal owns many archaeological properties in India. Kathmandu is gradually forgetting them,https://english.onlinekhabar.com/nepal-archaeological-properties-in-india.html,,"Nepal owns many archaeological properties in India. Kathmandu is gradually forgetting them Sudarshan Aryal Friday, October 22, 2021 0 Comments A Nepali dharmashala at Kedarnath temple in India. On the night of April 24, 1806, furious King Rana Bahadur Shah ordered his employees to behead Tribhuvan Khawas and to blind his younger brother Sher Bahadur Shah, on the charge of financial irregularities. However, in the blink of an eye, Sher Bahadur Shah killed the king himself. Before that, Rana Bahadur Shah had left the throne and settled in Kashi (Vanaras) of India as Nirgunananda Swami before he returned to Kathmandu in 1804 to serve as a regent of his minor son King Griwan Yudda Bikram Shah. As mentioned in an article by Bhesh Narayan Dahal, a former director-general of the Department of Archaeology, Rana Bahadur Shah lived at Lalita Ghat during his stay in Kashi. After Rana Bahadur Shah, during the reign of his grandson King Rajendra Bikram Shah, Lalita Ghat and Rajarajeshwari Ghat were rebuilt as Nepali heritage sites. Likewise, the Samrajyeshwari temple was built in the name of his queen Samrajya Lakshmi Devi. These monuments later came to be known as the ‘Nepali temple of Kashi’ and ‘Pashupati temple’. At present, Lalita Ghat and Samrajyeshwari temple are under the direct management of the Department of Archaeology of Nepal. And, the other one is managed by India. That is not one; during the Rana regime and even after that, many Nepali temples and dharamshalas were built in Vanaras. In the late 1950s, Jagadamba Kumari Devi, a consort of Madan Shamsher, the youngest son of Prime Minister Chandra Shamsher, also built dharmashalas: one at Mangalagauri in Vanaras and the other at Rameshwaram in Tamil Nadu, which are still in operation. Besides, there are many Nepali dharmasalas built in Assam, Odisha, Rishikesh, Kedarnath and different other pilgrimage sites in India. Unfortunately, many dharamshalas and Nepali heritage sites built in the eras of several rulers in several parts of India are being either neglected or mismanaged by the government of Nepal except for a few ones. Nominal effort for conservation During his tenure as the director-general of the Department of Archaeology (DoA), Bhesh Narayan Dahal had sent two teams to India around a decade ago to compile data on Nepali heritage. A team led by Sandeep Khanal, an official of the department, visited Haridwar, Rishikesh, Badrinath and Kedarnath in northern India. Another team led by Aruna Nakarmi visited Assam in northeastern India and Odisha, Tamil Nadu and Rameshwaram in the south. The teams had submitted a report to the DoA on the endangered condition of half a dozen prominent Nepali heritage sites in India. Shortly thereafter, the leadership of the department changed. Later, no action was taken on the data collected by the previous leadership, which is now gathering dust at the department. According to the spokesperson of the department, Ram Bahadur Kunwar, the department has allocated a budget for the protection of the Samrajyeshwar Temple and Lalita Ghat in Kashi this fiscal year as well. Journalist Kanak Mani Dixit, who is campaigning for the search and protection of Nepali heritage in India, is of the view that the government of Nepal should take interest in the protection of Nepali heritage in India. When Deep Kumar Upadhyay was Nepal’s ambassador to India, he was requested to search for such heritage and launch a conservation campaign, informs Dixit. Although the embassy was positive about the proposal at the time, Dixit says the work was abandoned after the change of the ambassador. He says the government now should take action for this. In South India Prime Minister Chandra Shamsher, who visited the UK in 1851, had performed a kshama puja, a religious function to be held to request the god for forgiveness, in Rameshwaram on his return. At the same place, Jagadamba Kumari Devi built a dharamshala in 1959 and even kept an inscription in which it is written ‘Shree Jagadamba Nepali Dharamsala, a gift to Nepali traveller from Mrs Rani Jagadamba Kumari Devi. Established on 2016 (BS) Shivaratri.’ Now, this dharamshala has also become a victim of neglect. The chief of the team sent by the DoA, Nakarmi says that Nepali heritage in Rameshwaram was found mismanaged. According to him, there was a tradition of sending Rs 500 from the Guthi Sansthan for the management of Nepali heritage in Rameshwaram. However, it has been a long time since this last happened. Due to this, the management (ownership) of the Nepali dharamshala in ​​Rameshwaram has increased the risk of getting out of Nepal’s hands, says Nakarmi. There is another Nepali dharamshala at Jagannath Dham in the Puri district of Odisha. According to Nakarmi, it is the most organised Nepali dharamshala in southern India. Even there, aid from Nepal has stopped. But, pilgrims from Nepal are still provided free meals and accommodation there. In Northeast India The Nepali dharamshala built near the Ka",1.8,2026-03-05T14:54:57.220089
