Constituency,DistrictEnglish,DistrictNepali,CandidateEnglish,CandidateNepali,Source,Title,URL,Snippet,Content,RelevanceScore,ScrapedAt
1,gorkha,गोरखा,Kedar Mani Khanal,केदार मणी खनाल,Ratopati,ओखलढुंगाको मानेभन्ज्याङका मतदाताले गरेनन् मतदान,https://www.ratopati.com/story/548144/voters-in-manebhanjyang-okhaldhunga-did-not-vote,,"ओखलढुंगाको मानेभन्ज्याङका मतदाताले गरेनन् मतदान रातोपाटी संवाददाता बिहीबार, २१ फागुन २०८२, ११ : १९ रातोपाटी संवाददाता बिहीबार, २१ फागुन २०८२ सारांश ओखलढुंगाको टोक्सेलस्थित मतदान केन्द्रका मतदाताहरूले मतदान बहिष्कार गरेका छन्। स्थानीयहरू प्रदेश सरकारले अस्पताल नबनाएको विरोधमा नो भोटमा उत्रिएका थिए। मुख्य निर्वाचन अधिकृतका अनुसार उक्त मतदान केन्द्रमा ७०१ मतदाता रहेका थिए। काठमाडौँ । ओखलढुंगाको एक मतदान केन्द्रका मतदाताहरुले मतदान बहिस्कार गरेका छन् । जिल्लाको मानेभञ्ज्याङ गाउँपालिका–७ को टोक्सेलस्थित मतदान केन्द्रमा मतदाताहरू मतादनमा सहभागी नभएको मुख्य निर्वाचन अधिकृत हरिप्रसाद कोइरालाले जानकारी दिए । स्थानीयले मत नहालेको खबरपछि आफू उक्त मतदान केन्द्र पुग्दा कोही पनि मतदाता उपस्थित नभएको पाइएको मुख्य निर्वाचन अधिकृत कोइरालाले बताए । ‘त्यहाँका मतदाता नो भोटमा उत्रिएको पाइयो । यो जानकारी आयोगका कार्यवहाक प्रमुख निर्वाचन आयुक्तलाई जानकारी गराइसकेको छु’, कोइरालाले रातोपाटीसँग भने । ‘जनप्रतिनिधिहरू गएर मुचुल्का गरिदिनुभएको छ । कर्मचारीहररू बसिरहनुभएको छ । भरे बेलुकासम्म कर्मचारीहररूको समानुपातिक जति भोट खस्छ त्यही मुचुल्का उठाएर पठाउँछौ’, मुख्य निर्वाचन अधिकृत कोइरालाले भने । मानेभञ्ज्याङ गाउँपालिकाका अध्यक्ष ज्ञानेन्द्र रूम्दालीले उक्त मतदान केन्द्रमा ७०१ जना मतदाता रहे पनि कोही पनि मतदानमा सहभागी नभएको बताए । उनका अनुसार प्रदेश सरकारले त्यस क्षेत्रमा प्रादेशिक अस्पताल बनाउने भने पनि काम सुरू नगरेको भन्दै स्थानीयहरू विरोधमा उत्रिएर मतदानमा सहभागी नभएको बताए । मतदान बहिस्कार ओखलढुंगा खबर पढेर तपाईलाई कस्तो महसुस भयो ? प्रतिक्रिया लेखकको बारेमा रातोपाटी संवाददाता ‘सबैको, सबैभन्दा राम्रो’ रातोपाटी डटकम। लेखकबाट थप भर्खरै तनहुँमा किरियापुत्रीद्वारा मतदान नुवाकोटमा दुई ठाउँबाट मतगणना हुने तस्बिरमा हेर्नुहोस् भक्तपुर बहुमुखी क्याम्पसको मतदान चितवनमा अहिलेसम्म ४५ प्रतिशत मतदान पहिलो पटक मत दिनेहरू भन्छन्– ‘हाम्रो भोट खेर जाँदैन’ कास्कीमा दिउँसो २ बजेसम्म ४३ प्रतिशत मत खस्यो, महिलाको सहभागिता उच्च ट्रेन्डिङ १. मतदान केन्द्रमा खटिएका कर्मचारी नै पक्राउ परेपछि... २. गन्तव्यमा नपुगी किन फर्कियो बालेन सवार हेलिकप्टर ? ३. बालेन चढेको हेलिकप्टर झापामा ल्यान्ड गरेन, काठमाडौँ फर्कँदै ४. श्रीलंका नजिकै इरानी युद्धपोतमा अमेरिकी आक्रमण, ८० नौसैनिकको मृत्यु ५. बुटवलमा पैसा बाँडेको आरोपमा एमाले र रास्वपाका कार्यकर्ताबिच झडप ६. कर्मचारीमाथि हातपात गर्न खोजेपछि दोलखामा हवाई फायर ७. चुनावमा खटिएका १२ जना सुरक्षाकर्मी र दुई मतदान अधिकृतको मृत्यु ८. राष्ट्रिय सुरक्षा परिषद्को बैठकले के गर्‍याे निर्णय ? छुटाउनुभयो कि ? निर्वाचन बहिष्कार गर्दै आन्दोलनको घोषणा प्रतिनिधि सभा उम्मेदवारले नै पार्टी छाडेपछि... प्रतिनिधि सभा उम्मेदवार पौडेलले फिर्ता लिए उम्मेदवारी रास्वपा र एमालेका कार्यकर्ताबिच झडप, २ जना घाइते धादिङमा बस दुर्घटना: १७ जनाको मृत्यु, २४ घाइते गौर झडप : ३ गाडी र दुई मोटरसाइकलमा आगजनी धादिङ बस दुर्घटनाः मृत्यु भएका १९ मध्ये ९ जनाको सनाखत (नामावलीसहित) बालेनलाई कारबाहीसहित नागरिकता रद्दको माग गर्दै गृह मन्त्रालयमा उजुरी",4.5,2026-03-05T14:54:57.220059
1,gorkha,गोरखा,Kedar Mani Khanal,केदार मणी खनाल,DDG (en1),Nepal Parliamentary Elections 2026/2082 - All Candidates List,https://nepsedata.com/nepal-election-2026-2082/,Welcome to the complete list ofcandidatesforNepal's2026 AD / 2082 BS ParliamentaryElections. This page shows all thecandidatesrunning for seats in the House of Representatives across all seven provinces ofNepal.,Welcome to the complete list ofcandidatesforNepal's2026 AD / 2082 BS ParliamentaryElections. This page shows all thecandidatesrunning for seats in the House of Representatives across all seven provinces ofNepal.,4.2,2026-03-05T14:54:57.220061
1,gorkha,गोरखा,Kedar Mani Khanal,केदार मणी खनाल,Reddit/r/Nepal,[r/Nepal] Is Nepal expecting “drastic change” from one election win? Or are we misunderstanding how development actually works?,https://www.reddit.com/r/Nepal/comments/1rgyp3p/is_nepal_expecting_drastic_change_from_one/,↑29  💬23,"Maile yo current Nepal ko political scenario herda ek interesting pattern dekheko chu. Social media ma dherai manche haru RASAPA, Congress, UML, aru party ko strong supporter chan. Sabai ko expectation chai eutai jasto lagcha — “yo party le jitepachi drastic change huncha.”
But honestly, ma sochchu — even if RASAPA wins tomorrow, will there be a drastic change immediately? Or even if any other party wins, will Nepal suddenly become like Australia or America?
Nepal ek developing country ho. Infrastructure, bureaucracy, economy, education system — yo sabai decades ko process ho. Australia, America jasto country haru pani 100+ years ko institutional development, stability, policy continuity bata aayeko ho. We cannot copy-paste development in 5 years.
Many Nepali youths want drastic improvement in lifestyle — good roads, system, rule of law, opportunities, low corruption. And that desire is valid. Tara question yo ho:
Are we expecting too much from one election cycle?
Can one party really change deep-rooted structural problems overnight?
Or is development more about long-term policy consistency, culture shift, and civic discipline?
Are we emotionally voting for hope instead of understanding systems?
Example: If someone from Nepal goes to America and sees system, discipline, infrastructure, they feel Nepal kehi pani gardaina.But that comparison ignores decades of gradual reform and economic growth.
So my real question to this community:
Is Nepal’s problem leadership matrai ho? Or is it institutional weakness, political culture, and public mindset pani equally responsible? And what kind of realistic change should we expect in 5 years vs 20 years?
I would love to hear logical, non-emotional answers.

Thekedar le time ma kaam saknu is considered development in Nepal. So yeah we expecting development
---
Every major institution has been paralyzed by party cadres, and they seem to favor certain groups of people. As a result, the rich are getting richer while the poor are getting poorer. Even crimes appear to be judged based on who someone is rather than what they have done.

Maybe after the election this nexus will finally be broken. And if the new party ends up doing the same, they too can be held accountable and removed.
---
tori haru ko common sense nai chaina ni ,iq 42 wala ho ta

bau haru hamro god hamro messiah baburam/prachande/oli aune bittikai nepal switzerland bhancha bhandai bhukyo

chora chori haru aile hamro messiah hamro god thuggi belun harke gangane aune bittikai nepal switzerland banche bhandai bhuki ra cha

janta hune bhanya chaukidar ra bhariya nai ho
---
Change (maybe not drastic) in KMC gives me hope.
---
No drastic changes are expected. Stable government for 5 years and infrastructure development time ma sakinxa ki vanne ho mainly fast track road and four lane east west highway.
---
Actually, im expecting a change in culture
---
The problem is not the leaders, it's the inefficient incentive structure, reward/punishment mechanism in the bureaucracy. Unfortunately, no party/candidates seem to have made civil service reform their major agenda, which could be the key driver for change. Hopefully, whoever wins, they figure that out early on.",4.2,2026-03-05T14:54:57.220063
1,gorkha,गोरखा,Kedar Mani Khanal,केदार मणी खनाल,DDG (en1),Know Your Candidate Nepal Election 2082 (2026) | नेपाल निर्वाचन २०८२,https://knowyourcandidate.nepabrita.com/,"Know YourCandidateNepalElection2082 BS (2026 AD). Complete verified information about all parliamentarycandidates. Compare, research, and make informed decisions.","Know YourCandidateNepalElection2082 BS (2026 AD). Complete verified information about all parliamentarycandidates. Compare, research, and make informed decisions.",3.6,2026-03-05T14:54:57.220065
1,gorkha,गोरखा,Kedar Mani Khanal,केदार मणी खनाल,Reddit/r/Nepal,[r/Nepal] Do any election candidates from anywhere in Nepal approximate these policy positions?,https://www.reddit.com/r/Nepal/comments/1po0thd/do_any_election_candidates_from_anywhere_in_nepal/,↑3  💬3,"Ofcourse no one will fullfil all the requirements but the point is to approximate.

My initial idea was to drop empty ballot in the ballot box but that would probably help UML, Congress, Maoists. So, from around Nepal, what candidates do you see who approximate some of the following policy positions?


**My Candidate Policy Positions Checklist (wishlist 😔)**  

*Rights Foundation*  
- Constitutionally state Individual Rights as absolute and not subject to override by any emergency provisions or by majority votes.
- Property rights inviolable (totally control earned wealth; repeal Foreign Exchange Regulation Act and Act Restricting Investment Abroad, 1964)
- Adult self-ownership (sovereignty over one’s body)  

*Economic Policy*  
- Constitutional separation of State and Economics
- Free pricing (supply-demand determines prices)  
- Unrestricted capital flows (open NEPSE and Nepalese Companies fully to foreign investors, Eliminate all capital controls)  

*Infrastructure Ownership*  
- Energy liberalization (dissolve Nepal Electricity Authority’s monopoly; permit private generation, transmission, and distribution)  
- Hydropower investment freedom (repeal mandatory asset transfer to government after 35 years)  
- Telecom ownership rights (repeal Section 33 of the Telecommunications Act, 2053, which mandates asset nationalization after 25 years for firms with over 50% foreign investment)

*Government Scope*  
- Minimal state (limited to courts, police, and national defense)  
- Sole function: protection of individual rights (no paternalism, no wealth redistribution) 
- Voluntary charity only (phase out Social Security Fund entirely)

These things makes sense. So, no election candidates with things making sense
---
Infrastructure ko point bahek, RSP fits the most. They have said many times they would encourage liberal market policies and they are center right so they would support individual liberty over excessive state control too.",3.6,2026-03-05T14:54:57.220068
1,gorkha,गोरखा,Kedar Mani Khanal,केदार मणी खनाल,DDG (en1),Gorkha Constituency 1 Candidates | Nepal Election 2082,https://www.nepalelection.live/explore/gorkha/gorkha-1,View detailed list ofcandidatesforGorkhaConstituency 1 ingorkhadistrict. Get latestelectionupdates andcandidateinformation.,View detailed list ofcandidatesforGorkhaConstituency 1 ingorkhadistrict. Get latestelectionupdates andcandidateinformation.,3.3,2026-03-05T14:54:57.220070
1,gorkha,गोरखा,Kedar Mani Khanal,केदार मणी खनाल,Reddit/r/Nepal,[r/Nepal] Nepal’s Monarchists Want a King to Save Them from the Horror of Too Many Rights,https://www.reddit.com/r/Nepal/comments/1j2k4vr/nepals_monarchists_want_a_king_to_save_them_from/,↑118  💬86,"Bring Back the Crown! We’re Tired of This “Freedom” Nonsense  
  
Nepal’s monarchists are back, whining like kids who lost their kite at Dashain, begging for a king to save them from democracy’s wild mess. Too many rights, too many loudmouths—it’s all too much! They want Gyanendra Shah to stumble out of hiding, slap on his crown, and smack away our freedoms so we can go back to the good old days: no opposition, no newspapers, just a king banning shit left and right. Genius move—why fix Nepal’s 2025 madness when you can just outlaw complaining about it? Crown him up, boys, what’s the worst that could happen?  
  
Nepal’s monarchy was never about helping us—it was about keeping us on a leash. The Ranas (1846–1951), those greasy-haired goons, turned Nepal into their own little tyrant playground. Education? Nope—can’t have us reading. Free speech? Nope—shut up or rot in jail. Rights? Ask, and you’d be tied up faster than a goat at a butcher’s. By ’51, only 5% of us could read—perfect, because who needs a revolution when you can’t even write “help”? Then the Shah kings rolled in, giggling, “Let’s ban more!” Mahendra killed parties in ’60, Gyanendra axed democracy in ’05 like he was swatting a fly. These guys banned stuff so hard, they’d have outlawed sunshine if it didn’t kiss their royal asses first.  
  
Gyanendra Shah didn’t even audition for king—he tripped into it after the 2001 royal family massacre turned into a horror show. By 2005, he was done with democracy’s chatter, so he went full dictator mode: dissolved parliament (who needs those clowns?), locked up leaders (too noisy), banned the press (truth’s messy). What’d we get? 1,400 in jail, newspapers gone, and streets full of folks chucking bricks, yelling, “Gyaney chor desh chhod” By ’06, we didn’t just kick him out—in ’08, we burned the whole monarchy down like a bad ex’s love letters. Now, with MPs throwing punches and veggie prices hitting the roof in 2025, some nutjobs want this guy back? Please, you royal bootlickers are dumber than a bag of hammers.  
  
If Nepal resurrects this monarchy crap, what’s Gyanendra banning next? He’s nailed the hits: education (brains breed trouble), free speech (words hurt), elections (kings don’t grovel). In 2025, he’d probably ban WhatsApp leaks of MPs slugging it out, or tax us for breathing Kathmandu’s smog-soup air. Picture it: “Royal Decree: No whining about Melamchi’s ghost pipes—lap up the mud, peasants!” Nepal’s youth are fleeing to Dubai faster than rats off a sinking raft—give ’em a king, and he’ll ban passports, claiming “loyalty’s hotter than remittance cash.” Our laws? Scribbled in royal drool while potholes mock us and jobs vanish. Sign me up—said no sane bastard ever.  
  
  
Here come the Rastriya Prajatantra Party (RPP)—Nepal’s weepy monarchy cheer squad. They’re awful at elections—7 out of 165 seats in ’22, losing worse than a drunk guy betting on buffalo races. With Nepal stuck in 2025’s circus—politicians slugging it out on live TV, prices turning rice into a luxury—they’ve decided democracy’s too tricky. Their big idea? Cry for a king to hand them the win. These losers are so pathetic, they’d crown a stray dog if it barked “Hindu kingdom.” Sorry, boys, Nepal’s too busy dodging coalition flops to care about your royal hard-on.  
  
Kings used to think education was poison—5% literacy meant we were too dumb to riot. Now, monarchists moan that democracy’s a headache: parliament’s a fistfight, tomatoes cost more than your rent, and half the country’s youth are slinging coffee in Dubai. We kicked kings out twice, fought for this hot mess, and won it fair and square. The RPP wants us crawling back because thinking’s hard? That’s not just stupid—it’s a slap to every Nepali who’s ever dodged a falling bridge. They’d ban the news tomorrow if it meant a king, while we’re stuck haggling for onions. Get real, you crown-loving saps.  
  
Monarchy’s dead, and no RPP tears or sappy nostalgia will bring it back. Nepal’s 2025 is a grind—MPs swinging fists, jobs vanishing, air so thick you’d think Kathmandu’s roasting itself—but a king’s as useful as a fart in a fan factory. To the monarchists, royalists, and RPP daydreamers: slap on your big fat L crown and waddle off. We’re done with your sad little fantasy—go cry into your royal fanfic while we dodge traffic and pray for cheaper chiya. Kings don’t fix shit; they just sit on it and stink.

Has there ever been a country in history where Monarchy was restored back after democracy was fully implemented? I don't know what Gyanendra is trying to cause with his constant noise about getting back but even he should know how much of a dangerous game he is playing here. Nepal will be literally torn to shreds and if India is backing him then the our law makers should act now before country goes into full civil war again.
---
Can you imagine in 2025, after two new generations of voting youth since the People's Revolution, someone actually taking RPP seriously? I mean Jesus",3.3,2026-03-05T14:54:57.220072
